qid,category,category_qid,en_label,ja_label,en_description,ja_description,mesh_id,icd10,icd9,snomed_id,umls_id
Q5861409,病気,Q12136,fescue toxicosis,,animal disease,,,,,,
Q10546563,病気,Q12136,hove disease,,,,,,,,
Q7654216,病気,Q12136,sweating sickness,,disease of cattle,,,,,,
Q22350879,病気,Q12136,Spondweni fever,,medical condition,,,A92.8,,,C0276292
Q41788331,病気,Q12136,Tick-borne paroxysmal rickettsiosis,,Infectious disease,,,,,,
Q7577471,病気,Q12136,spinal osteoarthropathy,,rare abnormal bone growth disorder in reptiles,,,,,,
Q10376457,病気,Q12136,balloon syndrome,,rare condition in hedgehogs,,,,,,
Q12195,病気,Q12136,poliomyelitis,急性灰白髄炎,human disease,ポリオウイルスによるウイルス性感染症,D011051,,,,C0032371
Q54911414,病気,Q12136,parasitic skin disease,,"skin disease caused by arthropods, helminths or other parasites",,D012876,,,,C0037280
Q7624020,病気,Q12136,stringhalt,,symptom in horses,,,,,,
Q54912126,病気,Q12136,bacterial sexually transmitted disease,,bacterial disease transmitted or propagated by sexual conduct,,D015231,,,,C0036917
Q5460213,病気,Q12136,floppy trunk syndrome,,,,,,,,
Q47790,病気,Q12136,tetanus,破傷風,bacterial infection characterized by muscle spasms,破傷風菌を病原体とする人獣共通感染症,D013742,,,,C0039614
Q6853,病気,Q12136,hepatitis B,B型肝炎,human viral infection,ウイルス性肝炎の一つ,D006509,B18.1,070.2,66071002,C0019163
Q55411849,病気,Q12136,Semliki Forest fever,,disease,,,,,,C0343598
Q55787061,病気,Q12136,non-syndromic brachydactyly of toes,,human disease,,,,,,C0432029
Q6086018,病気,Q12136,abomasal impaction,第四胃食滞,disease in cattle,,,,,,
Q55231802,病気,Q12136,animal helminthiasis,,infestation of animals with parasitic worms (helminths),,D006374,,,,C0018891
Q7233554,病気,Q12136,post-legged,,,,,,,,
Q7878801,病気,Q12136,ulcerative dermatitis,潰瘍性皮膚炎,medical condition,,,,,,
Q25098926,病気,Q12136,scedosporiosis,,human disease,,,,,,
Q55779847,病気,Q12136,iatrogenic Kaposi's sarcoma,,Kaposi sarcoma that develops after organ transplantation or immunosuppressive treatment,,,,,,C1334149
Q55779910,病気,Q12136,staphylococcus aureus infection,,infection by Staphylococcus,,,,,,C1318973
Q55779917,病気,Q12136,varicella zoster infection,水痘帯状疱疹感染症,highly contagious viral infection caused by the varicella zoster virus,,D000073618,,,,C0586989
Q6014862,病気,Q12136,inclusion body disease,,snake disease,,,,,,
Q9189872,病気,Q12136,chlamydophilosis,,,,,,,,
Q9581010,病気,Q12136,acute ruminal lactic acidosis,,,,,,,,
Q55779873,病気,Q12136,chronic hepatitis C,,Chronic form of hepatitis C infection,,D019698,,,,C0524910
Q55082255,病気,Q12136,animal Salmonella infection,,infections in animals with bacteria of the genus Salmonella,,D012481,,,,C0036118
Q54945069,病気,Q12136,animal parasitic disease,,animal disease caused by parasites,,D010273,,,,C0030500
Q4979092,病気,Q12136,Brunner Syndrome,ブルンナー症候群,"amino acid metabolic disorder characterized by recessive X-linked inhetiance, impaired monoamine metabolism, impulsive aggressiveness and mild mental retardation that has material basis in mutation in the MAOA gene on chromosome location Xp11",,C563156,,,,C0796275
Q30953,病気,Q12136,dengue fever,デング熱,"tropical disease caused by the dengue virus, transmitted by mosquito",熱帯病の一つ,D003715,A97,,38362002,C0011311
Q55223519,病気,Q12136,animal protozoan infections,,infections with unicellular organisms formerly members of the subkingdom Protozoa.,,D011529,,,,C0033741
Q7131598,病気,Q12136,pansteatitis,黄色脂肪症,animal disease,,D013231,,,,C0038235
Q28971,病気,Q12136,impetigo,膿痂疹,human disease,細菌感染症の一つ,D007169,,,,C0021099
Q10637946,病気,Q12136,porcelain disease,,fish disease,,,,,,
Q6948009,病気,Q12136,myopia in animals,,overview about myopia in animals,,,,,,
Q55009402,病気,Q12136,parasitic stramenopiles infectious disease,,"parasitic infectious disease that involves infection caused by parasitic members of the taxon stramenopiles, in which the flagellate cells possess two different shaped flagella. This taxon contains both unicellular and multicellular organisms",,,,,,
Q22461944,病気,Q12136,Rhinovirus infection,,viral human infection,,,,079.3,,C0276447
Q43987,病気,Q12136,avian influenza,トリインフルエンザ,influenza caused by viruses adapted to birds,鳥類が感染するウイルスにより発症するインフルエンザ,D005585,J09.009.0,488.0488.0,,C0016627
Q19597369,病気,Q12136,gram-negative bacterial infection,グラム陰性菌感染症,Infections caused by bacteria that show up as pink (negative) when treated by the gram-staining method,,D016905,,,,C0085423
Q55009178,病気,Q12136,Chlamydia pneumonia,,human disease,,,,,,
Q55009420,病気,Q12136,Trichomonas tenax trichomoniasis,,human disease,,,,,,
Q55636535,病気,Q12136,Unicentric Castleman disease,,Localized Castleman disease (LCD) is the most common form of Castleman disease (CD; see this term) and it is usually asymptomatic or it may present with enlarged lymph nodes. LCD may be cured by surgical resection.,,,,,,C3898582
Q8028152,病気,Q12136,Withering abalone syndrome,,sea snail disease,,,,,,
Q8028961,病気,Q12136,wobbly hedgehog syndrome,,neurological disease of hedgehogs,,,,,,
Q7440653,病気,Q12136,sealpox,,medical condition,,,,059.12,16677000,C0276191
Q6076840,病気,Q12136,Piscirickettsiaceae infections,,"Infections with bacteria of the family Piscirickettsiaceae, causing septicemic disease of salmonid fish",,D044225,,,,C1257878
Q27675547,病気,Q12136,vaccinia,,disease caused by smallpox vaccination with attenuated Vaccinia virus,,D014615,,,,C0042214
Q54931725,病気,Q12136,animal toxoplasmosis,,acquired infection of non-human animals by organisms of the genus Toxoplasma,,D014124,,,,C0040559
Q7278725,病気,Q12136,rabies in animals,,fatal viral disease in animals,,,,,,
Q5420726,病気,Q12136,exotic ungulate encephalopathy,,prion disease,,,,,,
Q5445319,病気,Q12136,ferret health,,overview about the health of ferrets,,,,,,
Q54927311,病気,Q12136,infectious encephalitis,,brain inflammation caused by an infectious agent,,D000069544,,,,C0596773
Q55779876,病気,Q12136,chronic hepatitis B,,chronic form of hepatitis B infection,,D019694,,,,C0524909
Q28456109,病気,Q12136,ischiopatellar dysplasia,,Small patella syndrome (SPS) is a very rare benign bone dysplasia affecting skeletal structures of the lower limb and the pelvis,,C535540,,,,C1840061
Q41083,病気,Q12136,syphilis,梅毒,sexually transmitted infection,梅毒トレポネーマの感染により発症する感染症,D013587,,093,,C0007939
Q125333650,病気,Q12136,cholera infantum,,disease state in infants,,,,,,
Q55785371,病気,Q12136,infectious epithelial keratitis,,human disease,,,,,,
Q60774347,病気,Q12136,Pacific Coast tick fever,,species of bacterium,,,A77.8,,,
Q39222,病気,Q12136,rabies,狂犬病,"deadly viral disease, transmitted through animals",狂犬病ウイルスの感染により発症する病気,D011818,,,,C0034494
Q41398,病気,Q12136,Morgellons,モルジェロンズ病,self-diagnosed skin condition,,D055535,F22.0,,,C2350431
Q55782051,病気,Q12136,Lymphokine deficiency,,human disease,,C565428,,,,C1855471
Q36956,病気,Q12136,leprosy,ハンセン病,chronic infection caused by bacteria Mycobacterium leprae,らい菌による慢性感染症,D007918,,,,C0023343
Q55782116,病気,Q12136,monocyte chemotactic disorder,,human disease,,C565371,,,,C1854982
Q55779965,病気,Q12136,infectious colitis,,viral or bacterial infectious process affecting the large intestine,,,,,,C0277524
Q55782293,病気,Q12136,rheumatic fever-related antigen,,human disease,,,,,,C1849383
Q109647487,病気,Q12136,parapertussis,,infectious disease,,,,,,
Q55785372,病気,Q12136,stromal keratitis,,,,,,,,C1318020
Q55783643,病気,Q12136,"malaria, mild, susceptibility to",,human disease,,,,,,C1836721
Q55783814,病気,Q12136,Plasmodium falciparum fever episodes quantitative trait locus 1,,human disease,,,,,,C1969647
Q55783742,病気,Q12136,"West nile virus, susceptibility to",,human disease,,,,,,C1835867
Q55784380,病気,Q12136,"pulmonary fibrosis and/or bone marrow failure, Telomere-related, 1",,human disease,,,,,,C3553617
Q55784390,病気,Q12136,susceptibility to human herpesvirus 8,,human disease,,,,,,C3553840
Q55784898,病気,Q12136,"pulmonary fibrosis and/or bone marrow failure, Telomere-related, 3",,human disease,,,,,,C4225346
Q55784897,病気,Q12136,"pulmonary fibrosis and/or bone marrow failure, Telomere-related, 4",,human disease,,,,,,C4225347
Q55785603,病気,Q12136,wound myiasis,,human disease,,,,,,C0344061
Q28936239,病気,Q12136,Al-Raqad syndrome,,congenital autosomal recessive syndrome discovered by Jordanian physician Mohammad Al-Raqad,,,,,,C4085595
Q135423375,病気,Q12136,Tremor disease,,,,,,,,
Q135434860,病気,Q12136,bitter crab disease,,,,,,,,
Q31798,病気,Q12136,chancroid,軟性下疳,sexually transmitted bacterial infection in humans,,D002602,,,,C0007947
Q123573455,病気,Q12136,onion poisoning,タマネギ中毒,,,,,,,
Q79054860,病気,Q12136,Mycoplasma pneumoniae infection,,bacterial disease,,,,,,
Q111180300,病気,Q12136,Strongylosis,,infectious disease,,,,,,
Q55783380,病気,Q12136,"human herpesvirus type 6, Integrated",,human disease,,C565771,,,,C1858340
Q63472138,病気,Q12136,cocoliztli epidemic,ココリツリの流行,16th century epidemics in New Spain,,,,,,
Q110624138,病気,Q12136,Jamestown Canyon encephalitis,,infectious disease,,,A83.8,,,
Q110391577,病気,Q12136,Flurona,フルロナ,combinated illness derivated of the SARS-CoV-2 virus and the influenza virus,インフルエンザとCOVID-19に同時に罹患すること,,,,,
Q131351764,病気,Q12136,endemic disease,,"infectious disease that occurs consistently in a specific region or population, with predictable incidence",,,,,,
Q55785577,病気,Q12136,limbic encephalitis with LGI1 antibodies,,,,,,,,
Q44727,病気,Q12136,chickenpox,水痘,human disease,感染症の一つ,D002644,B01,,,C0008049
Q127808155,病気,Q12136,Nanophyetiasis,,infectious disease in dogs due to Neorickettsia helminthoeca from Nanophytes salmincola,,,,,,
Q114799814,病気,Q12136,penile tuberculosis,,extrapulmonary tuberculosis that is located in penis,,,,,,
Q114799813,病気,Q12136,testicular tuberculosis,,extrapulmonary tuberculosis that is located in testis,,,,,,
Q114821886,病気,Q12136,ovarian tuberculosis,,extrapulmonary tuberculosis that is located in ovary,,,,,,
Q114821885,病気,Q12136,uterine tuberculosis,,extrapulmonary tuberculosis that is located in uterus,,,,,,
Q114822288,病気,Q12136,vaginal tuberculosis,,extrapulmonary tuberculosis that is located in vagina,,,,,,
Q12214,病気,Q12136,smallpox,天然痘,eradicated human disease,天然痘ウイルスの感染によって起こる病気,D012899,B03,050050,,C0037354
Q111030833,病気,Q12136,"Harmful effects of or exposure to noxious substances, chiefly nonmedicinal as to source, not elsewhere classified",,,,,,,,
Q36855,病気,Q12136,swine influenza,豚インフルエンザ,infection caused by any one of several types of swine influenza viruses,豚に感染するインフルエンザの一種,,J09.X2,,,C2076600
Q34879,病気,Q12136,staphylococcal infection,ブドウ球菌感染症,human disease,,D013203,,,,C0038160
Q115387860,病気,Q12136,septic bursitis,,infection and subsequent inflammation of a bursa,,,,,,
Q28448698,病気,Q12136,Hemochromatosis type 4,,hemochromatosis that has material basis in heterozygous mutation in the SLC40A1 gene on chromosome 2q32,,C537249,,,,C1853733
Q21097867,病気,Q12136,spinocerebellar ataxia type 27,,"Spinocerebellar ataxia type 27 (SCA27) is a very rare subtype of type I autosomal dominant cerebellar ataxia (ADCA type I; see this term). It is characterized by early-onset tremor, dyskinesia, and slowly progressive cerebellar ataxia.",,C537204,,,,C1836383
Q21097868,病気,Q12136,spinocerebellar ataxia type 28,,"Spinocerebellar ataxia type 28 (SCA28) is a very rare subtype of type I autosomal dominant cerebellar ataxia (ADCA type I; see this term). It is characterized by juvenile onset, slowly progressive cerebellar ataxia due to Purkinje cell degeneration.",,C537205,,,,C1853249
Q28208917,病気,Q12136,Aminoacylase 1 deficiency,,Aminoacylase 1 deficiency (ACY1D) is an inborn error of metabolism marked by a characteristic pattern of urinary N-acetyl amino acid excretion and neurologic symptoms,,C538246,,,,C1835922
Q21097871,病気,Q12136,episodic ataxia type 5,,Human disease,,C566601,,,,C1866039
Q21097864,病気,Q12136,spinocerebellar ataxia type 17,,Human disease,,C564616,,,,C1846707
Q21097865,病気,Q12136,spinocerebellar ataxia type 23,,Human disease,,C537201,,,,C1853250
Q28065642,病気,Q12136,isolated microphthalmia 7,,microphthalmia characterized by unilateral microphthalmia that has material basis in caused by mutation in the GDF3 gene on chromosome 12p13,,,,,,
Q28065643,病気,Q12136,isolated microphthalmia 2,,microphthalmia characterized by autosomal recessive inheritance of bilateral profound microphthalmia without associated anomalies and with normal intelligence that has material basis in homozygous mutation in the CHX10 gene on chromosome 14q24,,,,,,
Q28065646,病気,Q12136,isolated microphthalmia 3,,microphthalmia characterized by clinical anophthalmia and/or microphthalmia that has material basis in compound heterozygous mutation in the RAX gene on chromosome 18q21,,,,,,C5679828
Q28065645,病気,Q12136,isolated microphthalmia 8,,microphthalmia characterized by bilateral severe microphthalmia autosomal recessive inheritance of that has material basis in homozygous mutation in the ALDH1A3 gene on chromosome 15q26,,,,,,C3554524
Q28134983,病気,Q12136,Distal hereditary motor neuropathy type V,,human disease,,,,,,C1833308
Q28454436,病気,Q12136,failure of eruption of teeth,,human disease,,C565114,K00.8,,,C1852222
Q4417986,病気,Q12136,setariosis,,animal disease,,D012719,,,,C0036850
Q1767508,病気,Q12136,porcine proliferative enteropathy,ローソニア感染症,,,,,,,
Q195961,病気,Q12136,false memory syndrome,過誤記憶,syndrome,,,,,,
Q19587393,病気,Q12136,mitochondrial complex V (ATP synthase) deficiency nuclear type 2,,mitochondrial metabolism disease that has material basis in mutation in the TMEM70 gene on chromosome 8q21,,C567528,,,,C3279699
Q21097765,病気,Q12136,"autosomal dominant cerebellar ataxia, deafness and narcolepsy",,Human disease,,,,,,C1858804
Q21097785,病気,Q12136,nonprogressive cerebellar atxia with mental retardation,,Human disease,,,,,,C3553661
Q21097778,病気,Q12136,spinocerebellar ataxia type 36,,Human disease,,,,,,C3472711
Q21097777,病気,Q12136,spinocerebellar ataxia type 35,,Human disease,,,,,,C1539956
Q21097780,病気,Q12136,spinocerebellar ataxia type 38,,Human disease,,,,,,C4014812
Q21097781,病気,Q12136,spinocerebellar ataxia type 40,,Human disease,,,,,,CN219009
Q21097860,病気,Q12136,spinocerebellar ataxia type 12,,Human disease,,,,,,C1858501
Q1642040,病気,Q12136,hemarthrosis,関節内出血,bleeding into joint spaces,,D006395,,,,C0018924
Q21097786,病気,Q12136,autosomal recessive spinocerebellar ataxia 10,,human disease,,,,,,C3150998
Q21097751,病気,Q12136,spastic ataxia 1,,human disease,,,,,,C1970107
Q21097759,病気,Q12136,spastic ataxia 4,,human disease,,,,,,C3150925
Q21097757,病気,Q12136,spastic ataxia 2,,human disease,,,,,,C1969796
Q21097760,病気,Q12136,spastic ataxia 5,,human disease,,,,,,C3280977
Q4591781,病気,Q12136,Listeriosis in animals,,Disease caused by Listeria monocytogenes in various animal species,,,,,,
Q21051307,病気,Q12136,FRAXE intellectual disability,,FRAXE is a form of nonsyndromic X-linked mental retardation (NS-XLMR) characterized by mild intellectual deficit. FRAXE is the most common form of NS-XLMR.,,,,,,C0751157
Q1506840,病気,Q12136,reward deficiency syndrome,,,,,,,,
Q1725377,病気,Q12136,Clostridium Perfringens infection in piglets,,,,,,,,
Q4929100,病気,Q12136,blue eye disease,,species of virus,,,,,,
Q2308637,病気,Q12136,frontal fibrosing alopecia,,"Frontal fibrosing alopecia (FFA) is a rare variant of lichen planopilaris (see this term) characterized by symmetrical, progressive, band-like anterior hair loss of the scalp",,,,,,C1274700
Q2452665,病気,Q12136,bovine trichomoniasis,,,,,,,,
Q2533095,病気,Q12136,Von-Willebrand disease in animals,,,,,,,,
Q2336418,病気,Q12136,dysaethesia aethiopica,,alleged mental illness linked to scientific racism,,,,,,
Q4850362,病気,Q12136,bald sea urchin disease,,species of sea urchin,,,,,,
Q1362819,病気,Q12136,vertebral subluxation,サブラクセーション,chiropractic concept,,,,,,
Q3116781,病気,Q12136,avian influenza in animals,,,,,,,,
Q3281248,病気,Q12136,phocine distemper,,,,,,,,
Q6901315,病気,Q12136,monoamniotic twins,,identical twins that share the same amniotic sac within their mother’s uterus,,,,,,C0233363
Q366225,病気,Q12136,adopted child syndrome,,disputed syndrome,,,,,,
Q4686722,病気,Q12136,adverse vaccine reactions in pets,,,,,,,,
Q5282338,病気,Q12136,dislocation of hip in animals,,,,,,,,
Q1907943,病気,Q12136,Postpartum dysgalactia syndrome,,sow disease,,,,,,
Q4826020,病気,Q12136,autistic enterocolitis,,Nonexistent medical condition invented in fraudulent study by Andrew Wakefield,,,,,,
Q5405504,病気,Q12136,linear IgA bullous dermatosis,線状IgA水疱性皮膚症,Human disease,,D062027,,,,C0406650
Q101896,病気,Q12136,gonorrhea,淋病,sexually transmitted infection,淋菌への感染により起こる感染症,D006069,,,,C0018081
Q4907740,病気,Q12136,biliary fever,,"tick-borne disease of dogs, cats and horses",,,,,,
Q1777118,病気,Q12136,knee osteoarthritis,変形性膝関節症,Wear and tear of the cartilaginous joint surfaces of the knee joint.,,D020370,M17,,,C0409959
Q1956614,病気,Q12136,mycoplasmal polyserositis and arthritis of pigs,,,,,,,,C0276052
Q4832491,病気,Q12136,nutritional muscular dystrophy,白筋症,disease caused by a deficiency of selenium and vitamin E in dietary intake,,D014912,,,,C0043153
Q4684712,病気,Q12136,adrenal fatigue,副腎疲労,diagnosis of adrenal gland exhaustion,,,,,,
Q1088054,病気,Q12136,chronic cerebrospinal venous insufficiency,,term developed by Italian researcher Paolo Zamboni in 2008 to describe compromised flow of blood in the veins draining the central nervous system,,,I87.8,,,CL529180
Q3071319,病気,Q12136,fibropapillomatosis,,disease of sea turtles,,,,,,
Q21097764,病気,Q12136,autosomal recessive hypophosphatemic rickets,,"rickets that has material basis in autosomal recessive inheritance mutation in the DMP1 gene and is haracterized by hypophosphatemia, rickets and/or osteomalacia and slow growth",,C562792,,,,C0342643
Q327988,病気,Q12136,occupational burnout,燃え尽き症候群,"type of work-related stress, with symptoms characterized by feelings of energy depletion or exhaustion; increased mental distance from one’s job, or feelings of negativism or cynicism related to one's job; and reduced professional efficacy",,D002055,Z73.0,,,C0006433
Q21097861,病気,Q12136,spinocerebellar ataxia type 14,,"Spinocerebellar ataxia type 14 (SCA14) is a rare mild subtype of type I autosomal dominant cerebellar ataxia (ADCA type I; see this term). It is characterized by slowly progressive ataxia, dysarthria and nystagmus.",,C537196,,,,C1854369
Q21097855,病気,Q12136,spinocerebellar ataxia type 1,脊髄小脳変性症1型,"Spinocerebellar ataxia type 1 (SCA1) is a subtype of type I autosomal dominant cerebellar ataxia (ADCA type I; see this term) characterized by dysarthria, writing difficulties, limb ataxia, and commonly nystagmus and saccadic abnormalities",,,,,,C0752120
Q2570534,病気,Q12136,Candida hypersensitivity,,proposed syndrome,,,,,,
Q21097763,病気,Q12136,hereditary hypophosphatemic rickets with hypercalciuria,,Human disease,,C562793,,,,C0342645
Q1437576,病気,Q12136,electromagnetic hypersensitivity,電磁波過敏症,sensitivity to electromagnetic fields,,,,,,
Q4289690,病気,Q12136,ked itch,,medical condition,,,,,,
Q21097767,病気,Q12136,spinocerebellar ataxia type 19/22,,Human disease,,C537198,,,,C1846367
Q21097771,病気,Q12136,spinocerebellar ataxia type 26,,Human disease,,C537203,,,,C1836395
Q21097769,病気,Q12136,spinocerebellar ataxia type 21,,Human disease,,C537200,,,,C1843891
Q21097773,病気,Q12136,spinocerebellar ataxia type 29,,Human disease,,C537206,,,,C1861732
Q21097858,病気,Q12136,spinocerebellar ataxia type 10,,Human disease,,C566874,,,,C1963674
Q21097857,病気,Q12136,spinocerebellar ataxia type 8,,Human disease,,C537307,,,,C1837454
Q154878,病気,Q12136,toxoplasmosis,トキソプラズマ症,parasitic disease,,D014123,B58,130,,C0040558
Q19587394,病気,Q12136,mitochondrial complex V (ATP synthase) deficiency nuclear type 3,,mitochondrial metabolism disease that has material basis in mutation in the ATP5E gene on chromosome 20q13,,,,,,C3279708
Q19587395,病気,Q12136,mitochondrial complex V (ATP synthase) deficiency nuclear type 4,,mitochondrial metabolism disease that has material basis in mutation in the ATP5A1 gene on chromosome 18q,,,,,,C3808899
Q1660341,病気,Q12136,shoulder impingement syndrome,インピンジメント症候群,"syndrome which occurs when the tendons of the rotator cuff muscles become irritated and inflamed as they pass through the subacromial space, the passage beneath the acromion",,D019534,,726.2,,C0376685
Q21014372,病気,Q12136,microhydranencephaly,,severe abnormality of brain development characterized by both microcephaly and hydranencephaly,,C537555,,,,C1857977
Q21027078,病気,Q12136,Congenital lobar emphysema,,Congenital lobar emphysema (CLE) is a respiratory abnormality characterized by respiratory distress due to hyperinflation of one or more affected lobes of the lung,,C535735,,,,C0265797
Q19833018,病気,Q12136,autosomal dominant sideroblastic anemia,,sideroblastic anemia characterized by an autosomal dominant inheritance pattern,,C567160,,,,C2674249
Q1753520,病気,Q12136,rheumatoid nodule,,variant of polyarthritis,,D012218,,,,C0035450
Q5171113,病気,Q12136,corneal ulcers in animals,,veterinary inflammatory condition of the cornea,,,,,,
Q21097859,病気,Q12136,spinocerebellar ataxia type 11,,"Spinocerebellar ataxia type 11 (SCA11) is a subtype of autosomal dominant cerebellar ataxia type III (ADCA type III; see this term) characterized by the early-onset of cerebellar signs, eye movement abnormalities and pyramidal signs",,,,,,C1858351
Q21097863,病気,Q12136,spinocerebellar ataxia type 15/16,,"Spinocerebellar ataxia type 15/16 (SCA15/16) is a rare subtype of type I autosomal dominant cerebellar ataxia (ADCA type I; see this term). It is characterized by cerebellar ataxia, tremor and cognitive impairment.",,,,,,C1847725
Q4923912,病気,Q12136,blain,,animal disease,,,,,,
Q1647542,病気,Q12136,associated phoria,,controversial strabism,,,,,,
Q129104,病気,Q12136,anthrax,炭疽症,infection caused by Bacillus anthracis bacteria,炭疽菌を病原体とする細菌感染症,D000881,,,409498004,C0003175
Q2351339,病気,Q12136,drapetomania,ドラペトマニア,conjectural mental illness linked to scientific racism,,,,,,
Q3540866,病気,Q12136,avian keratin disorder,,bird disease,,,,,,
Q1722736,病気,Q12136,bacterial cold water disease,冷水病,bacterial disease of salmonid fish,,,,,,
Q20828711,病気,Q12136,spondylocarpotarsal synostosis syndrome,,human disease,,C535780,,,,C1848934
Q2709115,病気,Q12136,female hysteria,,outdated diagnosis for patients with multiple symptoms of a neurological condition,,,,,,
Q1947272,病気,Q12136,Baastrup's syndrome,,orthopedic and radiographic disorder that often occurs in elderly humans,,,,,,C0158248
Q3474070,病気,Q12136,animal lead poisoning,動物の鉛中毒,,,,,,,
Q21097758,病気,Q12136,spastic ataxia 3,,human disease,,C566956,,,,C1969645
Q2735920,病気,Q12136,hemopyrrollactamuria,,Toxic Induced Porphyria,,,,,,
Q4663376,病気,Q12136,abandoned child syndrome,,medical condition,,,,,,
Q2705600,病気,Q12136,dysorthography,,medical condition,,,F81.1,,,
Q2268113,病気,Q12136,selenium exposure,,hazardous chemical exposure,,,,,,CL495082
Q3144984,病気,Q12136,necrotising hepatopancreatitis,壊死性肝膵炎,lethal epizootic disease of farmed shrimp,,,,,,
Q50349603,病気,Q12136,ADan amyloidosis,,"cerebral amyloid angiopathy characterized by ataxia, intention tremor, psychosis and dementia that has material basis in an autosomal dominant mutation of ITM2B on chromosome 13q14.2",,C538209,,,,C1861735
Q50349590,病気,Q12136,autosomal recessive dyskeratosis congenita 2,,dyskeratosis congenita that has material basis in an autosomal recessive mutation of NOLA2 on chromosome 5q35.3,,,,,,C3151441
Q50349588,病気,Q12136,autosomal recessive dyskeratosis congenita 1,,dyskeratosis congenita that has material basis in an autosomal dominant mutation of NOLA3 on chromosome 15q14,,,,,,C1857144
Q50349592,病気,Q12136,autosomal recessive dyskeratosis congenita 3,,dyskeratosis congenita that has material basis in an autosomal recessive mutation of WRAP53 on chromosome 17p13.1,,,,,,C3151442
Q50349586,病気,Q12136,Seckel syndrome 2,,Seckel syndrome that has material basis in homozygous mutation in the RBBP8 gene on chromosome 18q11,,C537534,,,,C1847572
Q50349578,病気,Q12136,Seckel syndrome 9,,Seckel syndrome that has material basis in homozygous mutation in the TRAIP gene on chromosome 3p21,,,,,,C4225212
Q50349579,病気,Q12136,Seckel syndrome 6,,Seckel syndrome that has material basis in homozygous mutation in the CEP63 gene on chromosome 3q22,,,,,,C3553582
Q50349582,病気,Q12136,Seckel syndrome 8,,Seckel syndrome that has material basis in homozygous mutation in the DNA2 gene on chromosome 10q21,,,,,,C3891452
Q50349583,病気,Q12136,Seckel syndrome 4,,Seckel syndrome that has material basis in homozygous mutation in the CENPJ gene on chromosome 13q12,,,,,,C1826553
