qid,category,category_qid,en_label,ja_label,en_description,ja_description,mesh_id,icd10,icd9,snomed_id,umls_id
Q403453,病気,Q12136,Aicardi-Goutieres syndrome,エカルディ・グティエール症候群,a rare genetic neurodevelopmental disorder,,C535607,,,,C0393591
Q5958573,病気,Q12136,compulsive sexual behaviour disorder,色情症,mental disorder according to ICD-11,性欲の異常亢進,D000096583,,,,
Q390211,病気,Q12136,atrioventricular septal defect,心内膜床欠損症,Human disease,,D004694,,,,C0014116
Q11262043,病気,Q12136,Onsan illness,温山病,Cadmium poisoning caused by environmental pollution in the South Korean city of Onsan in the 1980s,,,,,,
Q390791,病気,Q12136,hepatoerythropoietic porphyria,,Human disease,,D017121,E80.2,277.1,111386004,C0162569
Q359288,病気,Q12136,Yushō disease,カネミ油症事件,mass poisoning in Japan,1960年代に日本で発生した油症事件,C536720,,,,C2931297
Q8054567,病気,Q12136,Yokkaichi asthma,四日市ぜんそく,Epidemic of asthma caused by air pollution in Japan,1970年ごろに起こった日本の公害問題,,,,,
Q106692972,病気,Q12136,lacerated kidney,,major trauma to the kidney,,,,,,
Q183472,病気,Q12136,itai-itai disease,イタイイタイ病,Japanese epidemic of cadmium poisoning,未処理廃水によるカドミウム過剰摂取状態で長期間生活してた婦中町(現:富山市)の農業従事者に発生していた公害病,,,,,
Q3508568,病気,Q12136,CHILD syndrome,,human disease,,C562515,Q87.8,,,C0265267
Q402575,病気,Q12136,maple syrup urine disease,メープルシロップ尿症,human disease,,D008375,,,,C0024776
Q15806106,病気,Q12136,dissexuality,,,,,,,,
Q419897,病気,Q12136,porphyria due to ALAD deficiency,,"porphyria that has symptom abdominal pain, has symptom neuropathy, has symptom autonomic instability and has symptom psychosis",,,E80.2,277.1,,C0162533
Q3508601,病気,Q12136,"Ehlers-Danlos syndrome, arthrochalasis type",,,,C562625,,,,C0268345
Q3508614,病気,Q12136,hyperinsulinism-hyperammonemia syndrome,,medical condition,,C538375,E72.8,,,C1847555
Q18387254,病気,Q12136,TB-Mission 2020,,,,,,,,
Q3501154,病気,Q12136,Larsen syndrome,,autosomal dominant disease that is characterized by large-joint dislocations and characteristic craniofacial abnormalities,,C580241,,,,C0175778
Q48988385,病気,Q12136,voretigene neparvovec,ボレチジーンネパルボベック,gene therapy medication,,,,,,
Q11085,病気,Q12136,Parkinson's disease,パーキンソン病,long-term degenerative neurological disorder,運動障害を示す進行性の神経変性疾患の一種,D010300,,,,C0030567
Q601168,病気,Q12136,peri-implantitis,,inflammatory disease,,D057873,,,,C2936258
Q556281,病気,Q12136,uterine fibroid,子宮筋腫,uterine benign neoplasm derived from the smooth muscle layer of the uterus,,,,,,C0042133
Q6954317,病気,Q12136,NIH funding of IBS Research,,,,,,,,
Q1472,病気,Q12136,Crohn's disease,クローン病,type of inflammatory bowel disease,主として口腔から肛門までの全消化管に、非連続性の慢性肉芽腫性炎症を生じる原因不明の炎症性疾患,D003424,,,,C0156147
Q387082,病気,Q12136,ataxia telangiectasia,毛細血管拡張性運動失調症,"a rare, neurodegenerative, autosomal recessive human disease causing severe disability",,D001260,G11.3,334.8,,C0004135
Q7826225,病気,Q12136,Toroku arsenic disease,土呂久砒素公害,disease caused by pollution in Japan,亜砒酸製造の「亜ヒ焼き」が引き起こした公害。,,,,,
Q63430622,病気,Q12136,Splenic sequestration crisis,,Illness,,,,,,
Q3508580,病気,Q12136,Joubert syndrome with orofaciodigital defect,,Joubert syndrome subtype with orofaciodigital defect,,C536531,,,,C2745997
Q7824270,病気,Q12136,tooth loss,,tooth wobbles and moves,,D016388,,,,C0080233
Q267907,病気,Q12136,hypersexuality,異常性欲,excessive arousal and interest in sex,量的または質的に異常な性欲,,F52.7,,,C3898830
Q18579,病気,Q12136,frontotemporal lobar degeneration,前頭側頭葉変性症,group of disorders,,D057174,,,,C0751072
Q3508616,病気,Q12136,Baller-Gerold syndrome,バレーゲロルド症候群,"synostosis characterized by coronal craniosynostosis, short stature, and aplasia or hypoplasia of the radial bone",,C536788,,,,C0265308
Q18583,病気,Q12136,progressive nonfluent aphasia,,neurological disorder,,D057178,,,,C0751706
Q1485,病気,Q12136,systemic lupus erythematosus,全身性エリテマトーデス,"inflammation of connective tissue marked by skin rashes, joint pain and swelling, inflammation of the kidneys and inflammation of the tissue surrounding the heart.",膠原病の一つ,D008180,,,,C0024141
Q11521711,病気,Q12136,Suginami desease,杉並病,,,,,,,
Q996200,病気,Q12136,Niigata Minamata disease,第二水俣病,Japanese outbreak of mercury poisoning,日本の公害病、有機水銀を含んだ廃液による食物連鎖で生じた中毒性中枢神経系疾患,,T56.1,985.0,,
Q337554,病気,Q12136,heat stroke,熱射病,"failure of the body to dissipate heat in an excessively hot environment, or during physical exertion",40℃を超える体温とせん妄を生じさせる重度の熱中症の一つ,D018883,T67.0,,,C0018843
Q18592,病気,Q12136,frontotemporal dementia,前頭側頭型認知症,medical condition,,D057180,G31.0,331.19,,C4229268
Q3508578,病気,Q12136,rapadilino syndrome,,Human disease,,C535288,Q87.1,,,C1849453
Q3508572,病気,Q12136,muscle-eye-brain disease,,disease,,,,,,C0457133
Q3508570,病気,Q12136,MASS syndrome,,Connective tissue disorder,,C536030,Q87.5,,,C1858556
Q1483,病気,Q12136,Craniopagus parasiticus,寄生的頭蓋結合体,rare type of Craniopagus,,,,,,
Q390908,病気,Q12136,Lucey–Driscoll syndrome,,autosomal recessive metabolic disorder affecting enzymes involved in bilirubin metabolism,,C562692,,774.30,,C0270210
Q3508618,病気,Q12136,Congenital contractural arachnodactyly,,human disease,,,,,,C0220668
Q3508563,病気,Q12136,leukoencephalopathy with vanishing white matter,,human disease,,,,,,C1858991
Q76643346,病気,Q12136,coronary artery disease in adults,,,,,,,,
Q76643393,病気,Q12136,Coronary heart disease in children,,,,,,,,
Q3508585,病気,Q12136,ablepharon macrostomia syndrome,,Human disease,,C535557,,,,C1860224
Q32778,病気,Q12136,bronchiectasis,気管支拡張症,disorder of respiratory system,,D001987,,,,C0006267
Q3508598,病気,Q12136,brittle cornea syndrome,,Human disease,,C536198,,,,C0268342
Q3508605,病気,Q12136,autosomal dominant type IV Ehlers-Danlos syndrome,,Human disease,,D000094623,,,,C0268338
Q5458307,病気,Q12136,Flea-borne spotted fever,,medical condition,,,A77.8,,,
Q3508735,病気,Q12136,Bare lymphocyte syndrome,裸リンパ球症候群,medical condition,,,D81.6,,,
Q3508705,病気,Q12136,Timothy syndrome,ティモシー症候群,"autosomal dominant disease that is characterized by cardiac, hand/foot, facial, and neurodevelopmental features; the two forms are type 1 (classic) and type 2, a rare form that has material basis in mutations in a transcript variant of CACNA1C",,C536962,,,,C1832916
Q493103,病気,Q12136,paramyotonia congenita,先天性パラミオトニア,human disease,,C538616,G71.1,359.2,,C0221055
Q3508649,病気,Q12136,Greig cephalopolysyndactyly syndrome,,"acrocephalosyndactylia that has material basis in mutation in the GLI3 gene which results in abnormal development located in limb, located in head, located in face",,C537300,Q87.0,,32985001,C0265306
Q5384031,病気,Q12136,Epstein–Barr virus infection,,Human disease,,D020031,,075,,C0149678
Q498826,病気,Q12136,sucrose intolerance,ショ糖不耐症,Congenital sucrase-isomaltase deficiency (CSID) is a carbohydrate intolerance disorder characterised by malabsorption of oligosaccharides and disaccharides,,C538139,E74.3,271.3,,C1283620
Q5763722,病気,Q12136,rhinoscleroma,,Human disease,,D012226,A48.8,,,C0035468
Q127556,病気,Q12136,osteochondritis dissecans,離断性骨軟骨炎,ischemic bone disease that results in necrosis located in epiphysis,,D010008,,,,C0029421
Q5334259,病気,Q12136,ectoparasitism,外部寄生,parasitic disease caused by organisms that live primarily on the surface of the host,,D004478,B89,132,,C0013578
Q3508634,病気,Q12136,Donnai-Barrow syndrome,,human disease,,C536390,,,,C1857277
Q3508679,病気,Q12136,Muenke syndrome,,human disease,,C537369,,,,C1864436
Q708165,病気,Q12136,neurogenic arthrogryposis multiplex congenita,関節拘縮,congenital joint contracture in two or more areas of the body,,C536614,,728.3,,C1859721
Q773118,病気,Q12136,Andersen-Tawil syndrome,,Human disease,,D050030,I45.8,426.82,,C1563715
Q3508723,病気,Q12136,solitary median maxillary central incisor syndrome,,human disease,,C537342,,,,C1840235
Q5609817,病気,Q12136,tinea pedis,足白癬,foot disease,,D014008,,,,C0040259
Q432396,病気,Q12136,achromatopsia,杆体1色覚,"human illness, a type of color blindness",,,,,,C0152200
Q3508623,病気,Q12136,Bruck syndrome,,syndrome characterized by a combination of multiple joint contractures and osteogenesis imperfecta,,,,,,C0432253
Q3508673,病気,Q12136,Melnick–Needles syndrome,,congenital disorder that affects primarily bone development.,,,,,,C0025237
Q3508750,病気,Q12136,Opitz-GBBB syndrome,,"monogenic disease that is characterized by hypertelorism, hypospadias, and additional midline defects resulting from mutations to the MID1 gene in the X-linked form or from a deletion on chromosome 22q11.2 in the autosomal dominant form",,,,,,C1801950
Q727436,病気,Q12136,Lesch-Nyhan syndrome,レッシュ・ナイハン症候群,rare genetic syndrome,,D007926,,277.2,,C0023374
Q3508782,病気,Q12136,otopalatodigital syndrome type 1,,,,,Q87.0,,,C2748918
Q492129,病気,Q12136,porencephaly,,congenital disorder of nervous system characterized by cysts or cavities within the cerebral hemisphere.,,D065708,,,38837006,C0302892
Q5509169,病気,Q12136,fungal meningitis,真菌性髄膜炎,meningitis that has material basis in a fungal infection,,D016921,,,,C0085438
Q424247,病気,Q12136,acute intermittent porphyria,急性間欠性ポルフィリン症,human disease,,D017118,E80.2,277.1,,C0162565
Q735652,病気,Q12136,mitral valve prolapse,僧帽弁逸脱症,mitral valve disease where one or both of the cusps of the mitral valve bulge or collapse backward in the left atrium during systole,,D008945,,424.0,,C0026267
Q498487,病気,Q12136,Camurati-Engelmann disease,,rare disease,,D003966,,756.59,,C0011989
Q500314,病気,Q12136,Kashin–Beck disease,カシン＝ベック病,"chronic, endemic osteochondropathy",,D057767,M12.1,716.0,,C2745963
Q772022,病気,Q12136,asplenia with cardiovascular anomalies,,rare disease,,,,759.0,,
Q6386930,病気,Q12136,Kemerovo tickborne viral fever,,infectious disease,,,A93.8,,,C0276459
Q478891,病気,Q12136,Simpson-Golabi-Behmel syndrome,シンプソン・ゴラビ・ベーメル症候群,"X-linked disease characterized by pre- and postnatal overgrowth and craniofacial, skeletal, cardiac and renal abnormalities",,C537340,Q87.0,,,C0796154
Q727008,病気,Q12136,McCune–Albright syndrome,マッキューン・オルブライト症候群,rare disease,,D005359,Q78.1,756.54,726029005,
Q3508669,病気,Q12136,Loeys-Dietz syndrome,ロイス・ディエツ症候群,Human disease,,D055947,,,446263001,C1836635
Q5743696,病気,Q12136,herpetic whitlow,,painful blister of the periungual skin that is caused by herpes simplex virus type 1 or 2,,,B00.8,,,C0153042
Q127664,病気,Q12136,febrile seizure,熱性けいれん,seizure associated with a high body temperature,温度が38°Cを超えると発生する発作,D003294,R56.0,,,C0009952
Q3508639,病気,Q12136,Goldberg-Shprintzen syndrome,,"syndrome characterized by intellectual disability, specific facial gestalt and Hirschsprung's disease (HSCR). It has material basis in homozygous mutation in the KIAA1279 gene on chromosome 10q21.1",,C537279,,,,C1836123
Q3508677,病気,Q12136,deafness dystonia syndrome,,"mitochondrial metabolism disease that is characterized by hearing loss that begins early in life, problems with movement, impaired vision, and behavior problems",,C535808,,,,C0796074
Q3508640,病気,Q12136,Meckel syndrome type 7,,Meckel syndrome that has material basis in an autosomal recessive mutation of NPHP3 on chromosome 3q22.1,,C537756,,,,C2673885
Q473262,病気,Q12136,complete androgen insensitivity syndrome,,intersex variation where one has no response to androgens and is born with a vulva and clitoris,,,E34.1,259.51,,
Q3508764,病気,Q12136,hand-foot-genital syndrome,,autosomal dominant human genetic disease characterized by limb malformations (e.g. bilateral shortening of thumbs/big toes) and urogenital defects (e.g. abnormalities of ureters/urethra; incomplete Müllerian fusion in females; hypospadias in males),,C535627,,,,C1841679
Q774016,病気,Q12136,Denys-Drash syndrome,デニス・ドラッシュ症候群,Human disease,,D030321,,,,C0950121
Q431643,病気,Q12136,microcephaly,小頭症,medical condition in which the brain does not develop properly resulting in a smaller than normal head,,D008831,,,,C0025958
Q5532924,病気,Q12136,genetic resistance to malaria,マラリアへの遺伝学的抵抗性,human disease,,,,,,C1970028
Q3508768,病気,Q12136,Lymphedema–distichiasis syndrome,,"people with this hereditary condition have a double row of eyelashes,",,C537710,,,,C0265345
Q3508686,病気,Q12136,Saethre-Chotzen syndrome,,acrocephalosyndactylia that has material basis in a genetic mutation in the TWIST1 gene which results in premature fusion located in skull,,,Q87.0,,,C0175699
Q3508706,病気,Q12136,Troyer syndrome,,"gene (13q13.1), which encodes the protein spartin.",,C536858,,,,C0393559
Q3508786,病気,Q12136,orofaciodigital syndrome I,口顔指症候群1型,orofaciodigital syndrome characterized_by polycystic kidney disease and variable involvement of the central nervous system and has_material_basis_in X-linked inheritance of the OFD1 gene,,,,,,C0026363
Q3508729,病気,Q12136,occipital horn syndrome,,"Occipital horn syndrome (OHS) is a mild form of Menkes disease (MD, see this term), a syndrome characterized by progressive neurodegeneration and connective tissue disorders due to a copper transport defect",,C537860,E83.0,,,C0268353
Q5428701,病気,Q12136,Factitious diarrhea,,infectious disease,,,,,,
Q6137239,病気,Q12136,hantavirus pulmonary syndrome,ハンタウイルス肺症候群,human disease,ハンタウイルスを病原体とする呼吸器感染症,D018804,J12.8,,,C0243025
Q3508674,病気,Q12136,McKusick–Kaufman syndrome,,"McKusick-Kaufman syndrome is a very rare, genetic developmental disorder presenting in the neonatal period characterized by genitourinary malformations, polydactyly, and more rarely, congenital heart disease or gastrointestinal malformations",,C538159,Q87.8,,,C0948368
Q3512243,病気,Q12136,autosomal dominant familial periodic fever,,human disease,,C536657,,,,C1275126
Q5849703,病気,Q12136,streptococcal infection,溶連菌感染症,human disease,広義にはレンサ球菌属による感染症すべてを、狭義には化膿レンサ球菌による感染症を指す語,D013290,,,,C0038395
Q130555,病気,Q12136,Norman–Roberts syndrome,,lissencephaly that has_material_basis_in homozygous mutation in the gene encoding reelin (RELN) on chromosome 7q22.,,C537848,,,,C0796089
Q774483,病気,Q12136,galactosemia,ガラクトース血症,carbohydrate metabolic disorder that involves a defect in galactose metabolism resulting in toxic levels of galactose 1-phosphate in various tissues,,D005693,,,,C0016952
Q494922,病気,Q12136,glycogen storage disease III,,human disease,,D006010,,271.0,,C0017922
Q3508800,病気,Q12136,congenital myasthenic syndrome,先天性筋無力症候群,Human disease,,D020294,,,,C0751882
Q6473911,病気,Q12136,herpes simplex,単純疱疹,viral disease caused by the herpes simplex virus,単純ヘルペスウイルス1・2型によって引き起こされる性感染症,D006561,,,,C0019348
Q5348632,病気,Q12136,Ehrlichiosis ewingii infection,,Human disease,,,,082.4,,
Q766856,病気,Q12136,pityriasis rubra pilaris,,Human disease,,D010916,,,,C0032027
Q5696358,病気,Q12136,focal epithelial hyperplasia,,"viral infectious disease that results in infection located in mouth, has material basis in human papillomavirus (types 13 or 32)",,D017573,,,,C0206067
Q6007089,病気,Q12136,impetigo herpetiformis,,impetigo that is characterized as a form of severe pustular psoriasis occurring in pregnancy,,,,,,C1314968
Q3508794,病気,Q12136,Tricho–rhino–phalangeal syndrome,,human disease,,,,,,C0265255
Q5376431,病気,Q12136,Endotheliitis,,inflammatory disease involving a pathogenic inflammatory response in the endothelium,,,,,,
Q3508770,病気,Q12136,inclusion body myopathy with Paget disease of bone and frontotemporal dementia,,syndrome,,,G71.8,,,
Q5548621,病気,Q12136,geotrichosis,,"opportunistic mycosis that has material basis in Galactomyces geotrichum, results in systemic infection in immunocompromised people",,D005847,,117.9,,C0017455
Q424258,病気,Q12136,acute interstitial pneumonitis,,human disease,,D000080203,,,,C1279945
Q132971,病気,Q12136,dyslexia,ディスレクシア,specific learning disability characterized by troubles with reading,文字の読み書きに関する学習障害,D004410,,,,C0476254
Q474254,病気,Q12136,Bannayan-Riley-Ruvalcaba syndrome,バナヤン・ライリー・ルバルカバ症候群,"a rare overgrowth syndrome and hamartomatous disorder with occurrence of multiple subcutaneous lipomas, macrocephaly and hemangiomas.",,,,,,C0265326
Q5656856,病気,Q12136,Nairobi disease,ナイロビ羊病,"arbovirus infection of sheep and goats transmitted by ticks, characterized by high fever and hemorrhagic gastroenteritis",,D009265,,,,C0027345
Q98080401,病気,Q12136,Breast hemangioma,,a very rare benign vascular neoplasm accounting for 0.4% of all breast tumors,,,,,,
Q55782588,病気,Q12136,syndactyly type 8,,human disease,,,,,,C1839728
Q55787167,病気,Q12136,Zygodactyly type 2,,human disease,,,,,,C5679982
Q55787168,病気,Q12136,Zygodactyly type 3,,human disease,,,,,,C5679983
Q55787169,病気,Q12136,Zygodactyly type 4,,human disease,,,,,,C5679981
Q55781850,病気,Q12136,"Ehlers-Danlos syndrome, fibronectinemic type",,,,C565600,,,,C1857038
Q55783673,病気,Q12136,mesoaxial synostotic syndactyly with phalangeal reduction,,,,C563721,,,,C1836206
Q4147980,病気,Q12136,granular corneal dystrophy type I,,human disease,,C537304,,,,C1641846
Q3813599,病気,Q12136,oxycephaly,尖頭症,cephalic disorder where the top of the skull is pointed or conical due to premature closure of the coronal suture plus any other suture,,,Q75.0,756.0,,C0030044
Q3813663,病気,Q12136,early infantile epileptic encephalopathy 9,,infantile epileptic encephalopathy that has material basis in the gene encoding protocadherin-19 (PCDH19) on chromosome Xq22,,,,,,C1848137
Q3765145,病気,Q12136,ichthyosis vulgaris,,skin disorder,,D016112,,757.1,254157005,C0079584
Q536269,病気,Q12136,phaeochromocytoma,褐色細胞腫,endocrine organ benign neoplasm that arises within the adrenal medulla,,D010673,D35.0,194.0,360332001,C0031511
Q541852,病気,Q12136,uncombable hair syndrome,梳かせない髪症候群,rare scalp hair shaft dysplasia,,C536939,Q84.1,,,C0432347
Q3616648,病気,Q12136,thoracic aortic aneurysm,胸部大動脈瘤,aortic aneurysm that is located in the thoracic aorta,,D017545,I71.2,441.1,,C0162872
Q4063436,病気,Q12136,alveolar soft part sarcoma,胞巣状軟部肉腫,soft tissue cancer that is a slow growing tumor of an unknown origin that effects children and effects young adults,,D018234,,,,C0206657
Q4178686,病気,Q12136,gelatinous drop-like corneal dystrophy,,Human disease,,C535480,,,,C0339273
Q3804555,病気,Q12136,X-linked ichthyosis,,skin condition caused by the hereditary deficiency of the steroid sulfatase (STS) enzyme that affects 1 in 2000 to 1 in 6000 males,,D016114,,757.1,,C0079588
Q745631,病気,Q12136,polyorchidism,多睾丸症,rare disease,,,Q55.2,752.89,,C0266430
Q530142,病気,Q12136,FG syndrome,FG症候群,disease,,C537923,,,,C0220769
Q3542021,病気,Q12136,endodermal sinus tumor,,germ cell cancer that has material basis in cells that line the yolk sac of the embryo,,D018240,,,74409009,C0014145
Q736633,病気,Q12136,mismatch repair cancer syndrome,ターコット症候群,genetic disease,,C536928,,,,C0265325
Q49989,病気,Q12136,Creutzfeldt-Jakob disease,クロイツフェルト・ヤコブ病,degenerative neurological disorder,中枢神経の変性疾患,D007562,,,,C0022336
Q737712,病気,Q12136,asplenia,無脾症,congenital disorder,,,D73.0,759.01,707147002,
Q3801629,病気,Q12136,hypoprothrombinemia,低プロトロンビン血症,Human disease,,D007020,D68.2,776.3,,C0020640
Q3589157,病気,Q12136,autosomal dominant nocturnal frontal lobe epilepsy,,frontal lobe epilepsy that is characterized by autosomal dominant inheritance with childhood onset of clusters of brief nocturnal motor seizures with hyperkinetic or tonic manifestations,,,,,,C3696898
Q3589156,病気,Q12136,Malignant Migrating Partial Seizures in Infancy,,a severe form of epilepsy that begins very early in life,,,,,,C3494976
Q3567797,病気,Q12136,hereditary mucosal leukokeratosis,,skin disease characterized by a defect in the normal process of keratinization of the mucosa,,D053529,,,,C1721005
Q4052543,病気,Q12136,dysequilibrium syndrome,,"Dysequilibrium syndrome (DES) is a non-progressive cerebellar disorder characterized by ataxia associated with an intellectual disability, delayed ambulation and cerebellar hypoplasia",,C535731,,,,C0403559
Q3589131,病気,Q12136,epidermolysis bullosa dystrophica,,inherited disease affecting the skin and other organs,,D016108,,757.39,254185007,C0079294
Q4162388,病気,Q12136,epithelial basement membrane dystrophy,,Human disease,,C535477,,,,C0521723
Q3539030,病気,Q12136,trichothiodystrophy syndromes,硫黄欠乏性毛髪発育異常症,human disease,,D054463,,,723551003,C0740342
Q4162393,病気,Q12136,Schnyder corneal dystrophy,,Human disease,,C535475,,,,C0271287
Q4162389,病気,Q12136,Thiel-Behnke corneal dystrophy,,Human disease,,C535942,,,,C1562894
Q750826,病気,Q12136,medium chain acyl-CoA dehydrogenase deficiency,,"lipid metabolism disorder that is characterized by a deficiency of the enzyme medium chain acyl-CoA dehydrogenase that results in the inability to convert medium chain fatty acids to energy, particularly during fasting",,C536038,E71.311,277.85,,C0220710
Q3616632,病気,Q12136,beta thalassemia,Βサラセミア,thalassemia characterized by the reduced or absent synthesis of the beta globin chains of hemoglobin,,D017086,,,,C0002875
Q756289,病気,Q12136,nephroblastoma,腎芽腫,rare disease,小児の腎腫瘍,D009396,C64,189.0,302849000,C1332219
Q61335,病気,Q12136,pre-eclampsia,子癇前症,hypertension occurring during pregnancy,,D011225,,642.4,398254007,C0032914
Q3830645,病気,Q12136,Leontiasis ossea,,medical condition,,,,376.44,,
Q741315,病気,Q12136,von Hippel-Lindau disease,フォン・ヒッペル・リンドウ病,a rare genetic disorder characterized by visceral cysts and benign tumors in multiple organ systems with potential for subsequent malignant change.,,D006623,,759.6,,C0019562
Q4127187,病気,Q12136,congenital stromal corneal dystrophy,,Human disease,,C566452,,,,C1864738
Q3843801,病気,Q12136,DeSanctis–Cacchione syndrome,,"rare autosomal recessive inherited syndrome. It is characterized by xeroderma pigmentosum, mental retardation, dwarfism, hypogonadism, and neurologic abnormalities",,C535992,,,,C0265201
Q3801522,病気,Q12136,Caffey disease,,bone inflammation disease in infants,,D006958,,756.59,,C0020497
Q4955836,病気,Q12136,brain stem neoplasm,,neoplasm (disease) that involves the brainstem,,D020295,,,,C0677866
Q744790,病気,Q12136,Treacher Collins syndrome,トリーチャーコリンズ症候群,human genetic disorder,頬骨の欠如等の顎顔面形態の不調和を特徴とする、常染色体優位先天性疾患のひとつ,D008342,,756.0,,C0242387
Q4127191,病気,Q12136,congenital hereditary endothelial dystrophy of cornea,先天性角膜内皮ジストロフィー,Human disease,,C536439,,,,C1857569
Q4064296,病気,Q12136,hereditary gelsolin amyloidosis,,Human disease,,,,,,C0936273
Q4162392,病気,Q12136,Meesmann corneal dystrophy,,type of corneal dystrophy and a keratin disease,,D053559,,,,C0339277
Q4162390,病気,Q12136,Reis-Bücklers corneal dystrophy,,disease of the human eye,,C535476,,,,C0339278
Q535364,病気,Q12136,Angelman syndrome,アンジェルマン症候群,genetic condition in humans,,D017204,,759.89,,C0162635
Q548719,病気,Q12136,aniridia,,Human disease,,D015783,,,,C0003076
Q3804556,病気,Q12136,lamellar ichthyosis,層状魚鱗癬,disease,,D017490,Q80.2,,,C4551630
Q3591493,病気,Q12136,erythrokeratodermia variabilis,,human disease,,D056266,,,,C0265961
Q4139987,病気,Q12136,glomus tumor,,hemangiopericytic tumor that is a mesenchymal neoplasm composed of cells that closely resemble the modified smooth muscle cells of the normal glomus body,,D005918,D18,,,C0017653
Q749409,病気,Q12136,osteogenesis imperfecta,骨形成不全症,osteochondrodysplasia that has material basis in a deficiency in type-I collagen which results in brittle bones and defective connective tissue,,D010013,Q78.078.0,756.51756.51,,C0023931
Q531019,病気,Q12136,aortic valve stenosis,大動脈弁狭窄症,aortic valve disease that has physical basis in incomplete opening of the aortic valve,,D001024,,,,C0152417
Q3598794,病気,Q12136,3-methylglutaconic aciduria,メチルグルタコン酸尿症,organic acidemia that is characterized by elevated levels of 3-methylglutaconic acid and 3-methylglutaric acid in the urine,,C579867,,276,,C3696376
Q81867,病気,Q12136,albinism,アルビノ,congenital disorder causing skin to lack pigmentation,,D000417,E70.3,270.2,,C0001916
Q3843807,病気,Q12136,Salla disease,,autosomal recessive lysosomal storage disease,,,,,,C1096903
