qid,category_en,category_ja,category_qid,en_label,ja_label,en_description,ja_description,mesh_id,icd10,icd9,snomed_id,umls_id
Q1734637,infectious disease,感染症,Q18123741,Common scab,そうか病,Plant disease affecting potatoes and other crops,,,,,,
Q41083,infectious disease,感染症,Q18123741,syphilis,梅毒,sexually transmitted infection,梅毒トレポネーマの感染により発症する感染症,D013587,,093,,C0007939
Q11775289,infectious disease,感染症,Q18123741,Peach scab,,fungal disease of stone fruits,,,,,,
Q125333650,infectious disease,感染症,Q18123741,cholera infantum,,disease state in infants,,,,,,
Q5788570,infectious disease,感染症,Q18123741,infectious coryza,伝染性コリーザ,disease of poultry,,,,,,
Q1104126,infectious disease,感染症,Q18123741,classic autism,,"former developmental disorder, since DSM-V replaced by Autism Spectrum Condition, type 2-3, with, or without, intellectual development disorder",,,F84.0,,,
Q8502088,infectious disease,感染症,Q18123741,apricot leaf scorch,,plant disease,,,,,,
Q97317440,infectious disease,感染症,Q18123741,Thysaniezia infection,,,,,,,,
Q11176055,infectious disease,感染症,Q18123741,red band needle blight,,,,,,,,
