en_label,ja_label,category,en_description,ja_description,qid
integumentary system,外皮系,解剖学的構造,"organ system that protects the body comprising the skin and its appendages (including hair, scales, feathers, hooves, and nails)",,Q483213
mammillary body,乳頭体,解剖学的構造,pair of small round bodies located on the undersurface of the brain,,Q499802
transverse facial artery,顔面横動脈,解剖学的構造,blood vessel,,Q486752
infraorbital artery,眼窩下動脈,解剖学的構造,blood vessel,,Q486809
sphenopalatine artery,蝶口蓋動脈,解剖学的構造,artery,,Q488936
left gastric artery,左胃動脈,解剖学的構造,,,Q508792
brachiocephalic artery,腕頭動脈,解剖学的構造,aorta descendens,,Q515917
lateral cutaneous nerve of thigh,外側大腿皮神経,解剖学的構造,nerve of the thigh,,Q510755
posterior auricular artery,後耳介動脈,解剖学的構造,Small artery,,Q489947
prostomium,口前葉,解剖学的構造,the cephized first body segment of an annelid worm's body,,Q489835
middle meningeal artery,中硬膜動脈,解剖学的構造,artery supplying the meninges,,Q500563
anterior spinal artery,前脊髄動脈,解剖学的構造,artery,,Q490172
posterior inferior cerebellar artery,後下小脳動脈,解剖学的構造,major artery supplying blood to the cerebellum,,Q488727
ascending pharyngeal artery,上行咽頭動脈,解剖学的構造,artery,,Q486797
central retinal artery,網膜中心動脈,解剖学的構造,artery located in the retina,,Q489722
Haplogroup P,ハプログループP,解剖学的構造,mtDNA,,Q511776
masseteric artery,咬筋動脈,解剖学的構造,blood vessel,,Q487078
celiac artery,腹腔動脈,解剖学的構造,first major branch of the abdominal aorta,,Q519368
supraoptic nucleus,視索上核,解剖学的構造,body of cells in the hypothalamus,,Q492272
proventriculus,前胃,解剖学的構造,"thin-walled, glandular stomach found in birds, where itprecedes the gizzard",,Q522113
thoracoacromial artery,胸肩峰動脈,解剖学的構造,blood vessel,,Q493410
The Younger Lady,若い方の淑女,解剖学的構造,mummy identified as the mother of the Pharaoh Tutankhamun,,Q516435
nuclear membrane,核膜,解剖学的構造,membrane part of the nuclear envelope,,Q465608
superior laryngeal artery,上喉頭動脈,解剖学的構造,,,Q487082
maxillary artery,顎動脈,解剖学的構造,artery supplying face structures in humans,,Q498171
sporangium,胞子嚢,解剖学的構造,spore-bearing part of a plant,,Q461275
subclavian artery,鎖骨下動脈,解剖学的構造,"major arteries of the upper thorax, below the clavicle",,Q490059
Descending palatine artery,下行口蓋動脈,解剖学的構造,artery of the head,,Q487474
subclavian vein,鎖骨下静脈,解剖学的構造,paired large vein,,Q493430
Ascending palatine artery,上行口蓋動脈,解剖学的構造,artery in the head that branches off the facial artery,,Q487467
middle cerebral artery,中大脳動脈,解剖学的構造,one of the three major paired arteries that supply blood to the cerebrum,,Q498179
nucleoid,核様体,解剖学的構造,"region of a virus, bacterial cell, mitochondrion or chloroplast to which the nucleic acid is confined",,Q459485
anterior cerebral artery,前大脳動脈,解剖学的構造,artery supplying the brain,,Q498935
gill raker,鰓篩,解剖学的構造,bony or cartilaginous processes that project from the branchial arch,,Q475167
posterior meningeal artery,後硬膜動脈,解剖学的構造,meningeal branch of the ascending pharyngeal artery,,Q485130
amyloplast,アミロプラスト,解剖学的構造,part of a plant,,Q482083
human chromosome 19,19番染色体 (ヒト),解剖学的構造,human chromosome,,Q510786
deep auricular artery,深耳介動脈,解剖学的構造,blood vessel,,Q487887
bronchiole,細気管支,解剖学的構造,passageways by which air passes through the nose or mouth to the alveoli of the lungs,,Q502704
water vascular system,水管系,解剖学的構造,hydraulic system in echinoderm anatomy,,Q459987
circle of Willis,大脳動脈輪,解剖学的構造,circulatory anastomosis that supplies blood to the brain and surrounding structures,,Q487595
superficial temporal artery,浅側頭動脈,解剖学的構造,major artery of the head,,Q494694
suprascapular artery,上肩甲骨,解剖学的構造,artery of the neck,,Q493426
buccal artery,頬動脈,解剖学的構造,Artery in the face of humans,,Q488932
angular artery,眼角動脈,解剖学的構造,artery of the face,,Q489189
Submental artery,オトガイ下動脈,解剖学的構造,branch of the facial artery,,Q488907
rhinophore,触角 (後鰓類),解剖学的構造,anatomy of groups of marine gastropods,,Q511082
brachial artery,上腕動脈,解剖学的構造,large blood vessel,,Q503643
inferior labial artery,下唇動脈,解剖学的構造,Artery in the lower lip,,Q484813
superior labial artery,上唇動脈,解剖学的構造,Artery in the upper lip,,Q484819
anal gland,肛門腺,解剖学的構造,glands found near the anus in many mammals,,Q484645
pulmonary vein,肺静脈,解剖学的構造,veins that transfer oxygenated blood from the lungs to the heart,,Q535352
lingual artery,舌動脈,解剖学的構造,arises from the external carotid between the superior thyroid and facial artery,,Q497582
inferior alveolar artery,下歯槽動脈,解剖学的構造,artery found in the head,,Q486774
Mauer 1,マウアー1,解剖学的構造,oldest-known human fossil found in Germany,,Q475670
posterior superior alveolar artery,後上歯槽動脈,解剖学的構造,blood vessel,,Q485350
internal iliac artery,内腸骨動脈,解剖学的構造,main artery of the pelvis,,Q532558
nuchal ligament,項靭帯,解剖学的構造,ligament at the back of the neck,,Q519216
epiblast,エピブラスト,解剖学的構造,"Embryonic inner cell mass tissue that forms the embryo itself, through the three germ layers",,Q519516
posterior cerebral artery,後大脳動脈,解剖学的構造,artery,,Q492482
internal jugular vein,内頸静脈,解剖学的構造,"paired vein collecting the blood from the brain, the superficial parts of the face, and the neck",,Q540598
greater occipital nerve,大後頭神経,解剖学的構造,nerve of the head,,Q498798
ophthalmic artery,眼動脈,解剖学的構造,artery of the head,,Q497574
hydrogenosome,ハイドロジェノソーム,解剖学的構造,mitochondrion-derived organelle in anaerobes,,Q525328
prosencephalon,前脳,解剖学的構造,forward-most part of the brain,,Q507027
hepatic portal vein,門脈,解剖学的構造,short thick vein formed by union of the superior mesenteric vein and the splenic vein,,Q464543
periodontal fiber,歯根膜,解剖学的構造,group of specialized connective tissue fibers that essentially attach a tooth to the alveolar bone within which it sits,,Q540092
paramesonephric duct,中腎傍管,解剖学的構造,paired ducts in the embryo in the primitive urogenital structures,,Q491057
vertebral artery,椎骨動脈,解剖学的構造,major arteries of the neck,,Q516546
tarsus,跗節,解剖学的構造,the last section of the leg of arthropods,,Q476820
basal ganglia,大脳基底核,解剖学的構造,"subcortical nuclei, of varied origin, in the brains of vertebrates",,Q464210
hemidesmosome,半接着斑,解剖学的構造,cell-substrate junction (attachment structure) found in epithelial cells that links intermediate filaments to extracellular matrices via transmembrane complexes,,Q1604780
nectar guide,蜜標,解剖学的構造,flower markings,,Q1642223
gastrodermis,胃層,解剖学的構造,inner layer of cells that serves as a lining membrane of the gastrovascular cavity of Cnidarians,,Q1495630
set of intercostal nerves,肋間神経,解剖学的構造,intercostal nerves supply motor and sensory innervation to the thorax and abdomen,,Q1515961
locus coeruleus,青斑核,解剖学的構造,stress and panic reponse center,,Q1470452
metencephalon,後脳,解剖学的構造,Part of the embryonic brain,,Q1500793
inferior frontal gyrus,下前頭回,解剖学的構造,part of the brain's prefrontal cortex,,Q1558534
supraspinous ligament,棘上靭帯,解剖学的構造,Ligament of the spine,,Q1471133
posterior cutaneous nerve of thigh,後大腿皮神経,解剖学的構造,,,Q1477923
basilic vein,尺側皮静脈,解剖学的構造,large blood vessel in the arm,,Q1601362
gerontoplast,ゲロントプラスト,解剖学的構造,part of a plant,,Q1514677
Haplogroup I,ハプログループI,解剖学的構造,mtDNA,,Q1584157
Haplogroup E,ハプログループE (mtDNA),解剖学的構造,mtDNA,,Q1584154
hepatic vein,肝静脈,解剖学的構造,one of two sets of veins connected to the liver,,Q1578686
volva,菌包,解剖学的構造,mycological structure,,Q1541152
sarcolemma,筋鞘,解剖学的構造,"the outer membrane of a muscle cell, consisting of the plasma membrane, a covering basement membrane (about 100 nm thick and sometimes common to more than one fiber), and the associated loose network of collagen fibers",,Q1545001
gametophore,茎葉体,解剖学的構造,the part of a plant that bears the reproductive organs,,Q1493115
genital tubercle,生殖結節,解剖学的構造,part of an embryo,,Q1502241
Hectocotylus,交接腕,解剖学的構造,sex organ,,Q1593118
precuneus,楔前部,解剖学的構造,part of the brain,,Q1632835
Haplogroup A,ハプログループA,解剖学的構造,mtDNA,,Q1584149
sacroiliac joint,仙腸関節,解剖学的構造,joint,,Q1543208
hypophyseal portal system,下垂体門脈系,解剖学的構造,system of blood vessels,,Q1531242
pyloric antrum,幽門洞,解剖学的構造,part of the stomach,,Q1635458
facial lymph nodes,顔面リンパ節,解剖学的構造,Lymph nodes of the face,,Q1519198
pachyostosis,骨格肥大現象,解剖学的構造,condition in which bones have an abnormally elevated density,,Q1562386
frontal eye field,前頭眼野,解剖学的構造,Region of the frontal cortex of the brain,,Q1470144
supramarginal gyrus,縁上回,解剖学的構造,It’s the part of the brain that is used for language and sensory,,Q1528202
Haplogroup F,ハプログループF (mtDNA),解剖学的構造,Human mitochondrial DNA haplogroup,,Q1526359
oak apple,没食子,解剖学的構造,"gall on oak leaves, caused by larvae of gall wasp (Cynipidae), especially Cynips quercusfolii",,Q1492220
Garnacha Roja,グルナッシュ・グリ,解剖学的構造,grape variety,,Q1545629
operculum,蓋 (腹足類),解剖学的構造,hard structure which closes the aperture of a gastropod when the animal retreats into the shell,,Q1480851
parahippocampal gyrus,海馬傍回,解剖学的構造,Grey matter region surrounding the hippocampus,,Q1545429
Haplogroup G,ハプログループG,解剖学的構造,mtDNA,,Q1544382
angular vein,眼角静脈,解剖学的構造,vein of the face,,Q1631914
Haplogroup B,ハプログループB,解剖学的構造,Human mitochondrial DNA haplogroup,,Q1584150
Haplogroup H,ハプログループH,解剖学的構造,mtDNA,,Q1584156
Haplogroup M,ハプログループM,解剖学的構造,mtDNA,,Q1584179
Haplogroup L3,ハプログループL3,解剖学的構造,mtDNA,,Q1584176
Haplogroup R,ハプログループR (mtDNA),解剖学的構造,mtDNA,,Q1584186
Haplogroup U,ハプログループU,解剖学的構造,mtDNA,,Q1584199
Haplogroup X,ハプログループX,解剖学的構造,mtDNA,,Q1584211
acromioclavicular joint,肩鎖関節,解剖学的構造,shoulder junction between the scapula and the clavicle,,Q1640207
blood–retinal barrier,血液網膜関門,解剖学的構造,part of the blood–ocular barrier that prevents certain substances from entering the retina,,Q1622103
nucleus accumbens,側坐核,解剖学的構造,region in the human basal forebrain rostral to the preoptic area of the hypothalamus,,Q1476178
origin recognition complex,複製起点認識複合体,解剖学的構造,multisubunit complex that is located at the replication origins of a chromosome,,Q1626856
pulp,砂瓤,解剖学的構造,flesh of a fruit,,Q1470757
sternocleidomastoid branch of superior thyroid artery,上甲状腺動脈胸鎖乳突筋枝,解剖学的構造,,,Q1684243
cephalic vein,橈側皮静脈,解剖学的構造,large blood vessel in the arm,,Q1670335
anterior sternoclavicular ligament,前胸鎖靭帯,解剖学的構造,anatomy,,Q4771398
alveolar septum,肺胞中隔,解剖学的構造,anatomical structure,,Q4737959
atrioventricular node branch of right coronary artery,右冠動脈房室結節枝,解剖学的構造,blood vessel,,Q4817567
adductor minimus muscle,小内転筋,解剖学的構造,small and flat skeletal muscle in the thigh,,Q4681420
auricular branch of occipital artery,後頭動脈の耳介枝,解剖学的構造,blood vessel,,Q4822343
auricular branch of posterior auricular artery,後耳介動脈耳介枝,解剖学的構造,blood vessel,,Q4822344
C4b-binding protein [plasma membrane],C4b結合タンパク質,解剖学的構造,instance of macromolecular complex in Homo sapiens with Reactome ID (R-HSA-981649),,Q5008230
bilaminar blastocyst,胚盤,解剖学的構造,Embryonic cell structure,,Q4907543
acromial branch of suprascapular artery,肩峰枝,解剖学的構造,,,Q4676181
basilar plexus,脳底静脈叢,解剖学的構造,blood vessel network,,Q4867299
AP-2 complex,AP2アダプター複合体,解剖学的構造,instance of macromolecular complex in Homo sapiens with Reactome ID (R-HSA-167712),,Q4653198
articular branches of descending genicular artery,下行膝動脈の関節枝,解剖学的構造,,,Q4800935
caruncle,肉阜,解剖学的構造,"small, fleshy excrescence that is a normal part of an animal's anatomy",,Q5047481
Cabot rings,カボット環,解剖学的構造,thin threadlike strands found on rare occasions in red blood cells,,Q4892104
zygomatic process of temporal bone,側頭骨頬骨突起,解剖学的構造,,,Q4918599
anterior superior alveolar arteries,前上歯槽動脈,解剖学的構造,blood vessels,,Q4771401
ascending branch of medial circumflex femoral artery,内側大腿回旋動脈の上行枝,解剖学的構造,small artery in the thigh,,Q4803816
ascending lumbar vein,上行腰静脈,解剖学的構造,vein on the vertebral column,,Q4803822
bronchial veins,気管支静脈,解剖学的構造,vein,,Q4973820
ascending branch of lateral circumflex femoral artery,外側大腿回旋動脈の上行枝,解剖学的構造,,,Q4803815
bifurcated ligament,二分靭帯,解剖学的構造,strong band,,Q4904823
basolateral amygdala,バソラテラル膜,解剖学的構造,brain region,,Q4867818
anterior ciliary arteries,前毛様体動脈,解剖学的構造,small arteries in the eye-socket,,Q4771332
anterior interventricular branch of left coronary artery,左前下行枝,解剖学的構造,artery of the heart,,Q4771358
anterior interosseous nerve,前骨間神経,解剖学的構造,branch of the median nerve that supplies muscles of the anterior forearm,,Q4771357
anterior spinal veins,前脊髄静脈,解剖学的構造,veins that receive blood from the anterior spinal cord,,Q4771394
anterior tibiofibular ligament,前脛腓靭帯,解剖学的構造,Ligament of the ankle,,Q4771413
accessory hemiazygos vein,副半奇静脈,解剖学的構造,Vein in the human body,,Q4672537
atrial branches of coronary arteries,冠状動脈の心房枝,解剖学的構造,blood vessels,,Q4817542
annulus,環帯,解剖学的構造,a ring of specialized cells on the sporangium,,Q4769748
musculus caudofemoralis,尾大体筋,解剖学的構造,tail muscle in many tailed animals,,Q5054402
acetabular fossa,寛骨臼窩,解剖学的構造,depression within the hip joint cavity (acetabulum),,Q4673239
acetabular branch of medial circumflex femoral artery,寛骨臼枝,解剖学的構造,artery in the hip,,Q4673242
basal vein,脳底静脈,解剖学的構造,vein in the brain,,Q4866185
aggresome,アグリソーム,解剖学的構造,inclusion body formed by dynein-dependent retrograde transport of an aggregated protein on microtubules,,Q4692265
abdominal fascia,腹筋膜,解剖学的構造,,,Q4665121
acromioclavicular ligament,肩鎖靭帯,解剖学的構造,Ligament of the shoulder girdle,,Q4676185
anterior cutaneous branch of iliohypogastric nerve,腸骨下腹神経の前皮枝,解剖学的構造,,,Q4771339
anterior scrotal arteries,前陰嚢動脈,解剖学的構造,branches of the deep external pudendal artery,,Q4771391
cell envelope,細胞外皮,解剖学的構造,"envelope that surrounds a bacterial cell and includes the cytoplasmic membrane and everything external, encompassing the periplasmic space, cell wall, and outer membrane if present",,Q4886486
cupula,クプラ,解剖学的構造,"structure in the vestibular system, providing the sense of spatial orientation",,Q4748565
Rhizopus oligosporus,テンペ菌,解剖学的構造,species of fungus,,Q4911649
anterior auricular branches of superficial temporal artery,浅側頭動脈前耳介枝,解剖学的構造,blood vessel,,Q4771323
anterior ulnar recurrent artery,掌側枝,解剖学的構造,blood vessel,,Q4771418
cavernous part of internal carotid artery,内頚動脈の海綿静脈洞部,解剖学的構造,,,Q5055062
wolf skin,オオカミの毛皮,解剖学的構造,fur of the wolf,,Q15855078
proteasome complex,プロテアソーム,解剖学的構造,"large multisubunit complex which catalyzes protein degradation, found in eukaryotes, archaea and some bacteria",,Q14878333
nuclear inner membrane,核内膜,解剖学的構造,"The inner, i.e. lumen-facing, lipid bilayer of the nuclear envelope.",,Q14903776
DNA replication factor C complex,複製因子C,解剖学的構造,"complex that loads the DNA polymerase processivity factor proliferating cell nuclear antigen (PCNA) onto DNA, thereby permitting processive DNA synthesis catalyzed by DNA polymerase. In eukaryotes the complex consists of five polypeptides",,Q14902224
COP9 signalosome,COP9シグナロソーム,解剖学的構造,"protein complex that catalyzes the deneddylation of proteins, involved in many regulatory process",,Q14905184
autophagosome,オートファゴソーム,解剖学的構造,double-membrane-bounded compartment that engulfs endogenous cellular material as well as invading microorganisms to target them to the lytic vacuole/lysosome for degradation as part of macroautophagy,,Q14882441
collagen type I trimer,I型コラーゲン,解剖学的構造,a collagen trimer containing alpha(I) chains,,Q14881714
cell outer membrane,細胞外膜,解剖学的構造,lipid bilayer that forms the outermost membrane of the cell envelope,,Q14906131
Mre11 complex,MRX複合体,解剖学的構造,"Trimeric protein complex that possesses endonuclease activity; involved in meiotic recombination, DNA repair and checkpoint signaling. In Saccharomyces cerevisiae, the complex comprises Mre11p, Rad50p, and Xrs2p; complexes identified in other species",,Q14911996
voltage-gated calcium channel complex,電位依存性カルシウムチャネル,解剖学的構造,protein complex that forms a transmembrane channel through which calcium ions may pass in response to changes in membrane potential,,Q14905735
transcription factor TFIIH holo complex,TFIIH,解剖学的構造,complex that is capable of kinase activity directed towards the C-terminal Domain (CTD) of the largest subunit of RNA polymerase II and is essential for initiation at RNA polymerase II promoters in vitro. It is composed of the core TFIIH complex a,,Q14908082
mitotic spindle,有糸分裂紡錘体,解剖学的構造,spindle that forms as part of mitosis. Mitotic and meiotic spindles contain distinctive complements of proteins associated with microtubules,,Q14908513
stomatognathic system,顎口腔系,解剖学的構造,"anatomical system including, but not limited to teeth, jaw and its muscles",,Q3774147
Irish breakfast tea,アイリッシュ・ブレックファストティー,解剖学的構造,a strong blend of black teas,,Q3818294
Homo gardarensis,ホモ・ガルダレンシス,解剖学的構造,,,Q3786472
arcuate artery of kidney,腎弓状動脈,解剖学的構造,artery,,Q3822829
superior temporal gyrus,上側頭回,解剖学的構造,..obe,,Q3064601
lamellipodium,膜状仮足,解剖学的構造,thin sheetlike process extended by the leading edge of a migrating cell or extending cell process,,Q3092607
inferior suprarenal artery,下副腎動脈,解剖学的構造,artery that supplies the adrenal gland,,Q2865999
temporoparietal junction,側頭頭頂接合部,解剖学的構造,brain area,,Q2940216
Rize tea,リゼ・ティー,解剖学的構造,black tea variety from Turkey,,Q2912478
dorsal nasal artery,鼻背動脈,解剖学的構造,blood vessel,,Q3270735
anterior ethmoidal artery,前篩骨動脈,解剖学的構造,blood vessel,,Q3270899
premotor cortex,前運動皮質,解剖学的構造,part of the cerebral cortex,,Q2998090
Artery of Adamkiewicz,アダムキュービッツ動脈,解剖学的構造,largest anterior segmental medullary artery,,Q2865993
Lacteal,乳糜管,解剖学的構造,lymphatic capillary,,Q2967754
vasa vasorum,脈管栄養血管,解剖学的構造,network of small blood vessels,,Q2915951
endocardial cushion,心内膜床,解剖学的構造,specialized region of mesenchymal cells that will give rise to the heart septa and valves,,Q2879939
Mummy of San Andrés,サン・アンドレスのミイラ,解剖学的構造,Guanche mummy,,Q2915934
Macro-haplogroup L,マクロ＝ハプログループL,解剖学的構造,Human mitochondrial lineage,,Q3274906
maxillary veins,顎静脈,解剖学的構造,vein of the head,,Q3241280
Zuiyo-maru carcass,ニューネッシー,解剖学的構造,basking shark corpse caught by the Japanese fishing trawler Zuiyō Maru off the coast of New Zealand in 1977,,Q2985169
posterior ethmoidal artery,後篩骨動脈,解剖学的構造,artery of the head which supplies the nasal septum,,Q3278179
right pulmonary artery,右肺動脈,解剖学的構造,,,Q2917413
hypogastrium,下腹部,解剖学的構造,region of the abdomen,,Q3144280
aster,星状体,解剖学的構造,cellular structure shaped like a star,,Q2868390
mental branch of inferior alveolar artery,オトガイ動脈,解剖学的構造,,,Q2919618
great cardiac vein,大心臓静脈,解剖学的構造,great cardiac vein,,Q2886255
"major histocompatibility complex, class I, G",HLA-G,解剖学的構造,mammalian proteins found in Homo sapiens,,Q3124896
pseudostratified columnar epithelium,偽重層円柱上皮,解剖学的構造,tissue type,,Q3267446
simple cuboidal epithelium,単層立方上皮,解剖学的構造,tissue type,,Q3267455
superior suprarenal artery,上副腎動脈,解剖学的構造,artery of the abdomen,,Q3290350
artery of the pterygoid canal,翼突管動脈,解剖学的構造,Vidian artery,,Q3271220
middle frontal gyrus,中前頭回,解剖学的構造,part of the brain's frontal lobe,,Q3063753
Mummies of Llullaillaco,ジュジャイジャコのミイラ,解剖学的構造,"mummies discovered in 1999 at Mount Llullaillaco, on the border of Chile and Argentina",,Q3054170
Yingdehong tea,英徳紅茶,解剖学的構造,black tea,,Q2908881
arp2/3 protein complex,Arp2/3,解剖学的構造,macromolecular complex,,Q3274575
Lamina densa,基底板,解剖学的構造,layer of the skin,,Q3216737
descending aorta,下行大動脈,解剖学的構造,large artery passing vertically through the chest and abdomen,,Q3270170
splenic vein,脾静脈,解剖学的構造,"vein that drains blood from the spleen, stomach and pancreas",,Q3091615
T-tubule,横行小管,解剖学的構造,invagination of the plasma membrane of a muscle cell that extends inward from the cell surface around each myofibril; the ends of T-tubules make contact with the sarcoplasmic reticulum membrane,,Q2983734
accessory cephalic vein,副橈側皮静脈,解剖学的構造,vein that passes along the radial border of the forearm,,Q3320895
human Y chromosome,Y染色体 (ヒト),解剖学的構造,chromosome,,Q2966734
median cubital vein,肘正中皮静脈,解剖学的構造,The vein of choice for intravenous injection for withdrawing blood from donors and for catheterization,,Q3320949
common iliac vein,総腸骨静脈,解剖学的構造,veins draining blood from the pelvis and lower limbs,,Q3143036
external iliac vein,総腸骨静脈,解剖学的構造,blood vessels connecting the thigh veins to the pelvis,,Q3090687
Cajal body,カハール体,解剖学的構造,class of nuclear body enriched in small nuclear ribonucleoproteins,,Q3234345
branch,枝,解剖学的構造,part of a tree; a shoot axis that develops from an axillary bud meristem or from equal divisions of a meristematic apical cell,,Q2923673
mediator complex,メディエーター,解剖学的構造,protein complex that interacts with the carboxy-terminal domain of the largest subunit of RNA polymerase II,,Q14886885
parietal branch of superficial temporal artery,浅側頭動脈頭頂枝,解剖学的構造,curves upward and backward on the side of the head,,Q7137055
ParaHox,ParaHox 遺伝子,解剖学的構造,gene cluster,,Q7133636
muscular branches of the radial nerve,橈骨神経の筋枝,解剖学的構造,nerve system,,Q6940379
perforating arteries,大腿深動脈の貫通動脈,解剖学的構造,subdivision of deep femoral artery,,Q7168172
mitochondrial permeability transition pore,ミトコンドリア透過性遷移,解剖学的構造,multiprotein inner mitochondrial complex which opens only under certain pathological conditions,,Q6881880
petrous portion of the internal carotid artery,内頚動脈錐体部,解剖学的構造,,,Q7179125
ovarian branch of uterine artery,子宮動脈の卵巣枝,解剖学的構造,blood vessel,,Q7113256
posteromedial central arteries,後内側中心動脈,解剖学的構造,also known as posteromedial central arteries,,Q7135174
palmar carpal branch of radial artery,橈骨動脈の掌側手根枝,解剖学的構造,small blood vessel that crosses the wrist bones to join with the palmar branch of the ulnar artery,,Q7128138
