en_label,ja_label,category,en_description,ja_description,qid
Lemierre's syndrome,レミエール症候群,病気,Human disease: infectious thrombophlebitis of the internal jugular vein,菌血症による感染性血栓性頸静脈炎である疾患群,Q72000
tetraphobia,四の字,病気,"avoidance of instances of the number 4, due to homophony of the hanzi 四 (4) and 死 (death) in many East Asian languages",漢字文化圏における忌み数,Q72210
bone fracture,骨折,病気,medical condition in which there is physical damage to the continuity of the bones,直達外力や介達外力により骨が変形、破壊を起こす外傷であり、構造の連続性が絶たれた状態,Q68833
herpes zoster,帯状疱疹,病気,viral disease caused by the Varicella zoster virus,水疱瘡の感染歴のある人が発症する、神経に潜んでいた水痘・帯状疱疹ウイルスが引き起こす皮膚疾患,Q182155
attention deficit hyperactivity disorder,注意欠陥・多動性障害,病気,neurodevelopmental disorder,神経発達症の一種,Q181923
yawn,あくび,病気,reflex,眠い時に出る呼吸動作,Q182180
typhoid fever,腸チフス,病気,bacterial infectious disorder contracted by consumption of food or drink contaminated with Salmonella typhi. This disorder is common in developing countries and can be treated with antibiotics.,サルモネラ属の細菌を病原体とする感染症,Q83319
measles,麻疹,病気,viral disease affecting humans,麻疹ウイルスによる感染症,Q79793
depersonalization,離人症,病気,anomaly of self-awareness,自分が自分の心や体から離れていったり、また自分が自身の観察者になるような状態を感じること,Q83177
urinary incontinence,尿失禁,病気,uncontrolled leakage of urine,尿を失禁すること,Q281490
Proteus syndrome,プロテウス症候群,病気,"human disease characterized by an overgrowth of skin, bones, muscles, fatty tissues, and blood and lymphatic vessels",身体の変形などをもたらす希少疾患,Q281115
mania,躁病,病気,"state of abnormally elevated or irritable mood, arousal, and/or energy levels",気分高揚・万能感・活動性激増・多弁・自己過大評価・睡眠激減・観念奔逸・病識欠如などを特徴とする精神疾患,Q185935
neurasthenia,神経衰弱,病気,"psychopathological term to denote a condition with symptoms of fatigue, anxiety, headache, heart palpitations, high blood pressure, neuralgia, and depressed mood",精神疾患の診断名の一つ,Q510236
itai-itai disease,イタイイタイ病,病気,Japanese epidemic of cadmium poisoning,未処理廃水によるカドミウム過剰摂取状態で長期間生活してた婦中町(現:富山市)の農業従事者に発生していた公害病,Q183472
pyelonephritis,腎盂腎炎,病気,Human disease,腎盂ならびに腎実質の炎症,Q506652
hypomania,軽躁病,病気,mood state characterized by persistent and pervasive elevated or irritable mood,双極性障害（躁鬱病）という精神疾患における、﻿気分高揚や活動性亢進状態の期間,Q188611
human papillomavirus infection,ヒトパピローマウイルス,病気,infection caused by the human papillomavirus (HPV),尖圭コンジローマや子宮頸がん、中咽頭がんなどの原因とされるウイルス,Q184627
Esca,エスカ,病気,type of grapevine trunk disease,ブドウの幹の病気,Q284145
stuttering,吃音症,病気,"speech disorder in which the flow of speech is disrupted by involuntary repetitions and prolongations of sounds, syllables, words, or phrases as well as involuntary silent pauses or blocks in which the person who stutters is unable to produce sounds",言葉が円滑に話せない、スムーズに言葉が出てこないこと,Q186676
rheumatoid arthritis,関節リウマチ,病気,autoimmune disease which attacks healthy cells and tissue located in joints,関節炎を主体とする炎症性疾患,Q187255
nephrotic syndrome,ネフローゼ症候群,病気,Human disease,尿中に大量のタンパク質が排出されることにより、血液中のタンパク質の濃度が薄くなる結果、むくみ（浮腫）等の異常が起こる疾患,Q504790
severe acute respiratory syndrome,重症急性呼吸器症候群,病気,viral respiratory disease,SARSコロナウイルスの感染で発症するウイルス性呼吸器感染症,Q103177
rhinitis,鼻炎,病気,irritation and inflammation of the mucous membrane inside the nose,鼻腔の粘膜に発生した、急性または慢性の炎症,Q114085
congenital myopathy,先天性ミオパチー,病気,human disease,フロッピーインファント症状を引き起こす疾患群,Q112412
hepatitis E,E型肝炎,病気,an inflammation of the liver caused by infection with the hepatitis E virus,食品が媒介するウイルス性肝炎,Q326643
inferiority complex,劣等感,病気,an intense feeling of inferiority,自分が他人に劣っていると感じること,Q319763
Huntington's disease,ハンチントン病,病気,"rare neurodegenerative disorder of the central nervous system characterized by unwanted choreatic movements, behavioral and psychiatric disturbances and dementia",遺伝子の第1エクソンのCAGの繰り返し配列が異常に伸びることによる変性疾患,Q190564
delusion,妄想,病気,firm and fixed belief based on inadequate grounding,その文化において共有されない誤った確信,Q189643
colony collapse disorder,蜂群崩壊症候群,病気,poorly-understood phenomenon causing decline in bee populations,ミツバチが原因不明で大量に失踪する現象,Q497841
trichinosis,旋毛虫症,病気,parasitic disease due to invasion by Trichinella spp.,旋毛虫 の感染を原因とする人獣共通感染症,Q495146
gonorrhea,淋病,病気,sexually transmitted infection,淋菌への感染により起こる感染症,Q101896
catatonia,緊張病,病気,"psychopathological syndrome, a group of postural and movement abnormalities",精神運動の低下および昏迷状態に代表される異常行動を特徴とする状態,Q501571
sepsis,敗血症,病気,life-threatening response to infection,感染症に対する制御不能な生体反応からくる致命的な臓器障害,Q183134
sinusitis,副鼻腔炎,病気,inflammation of the mucous membrane that lines the sinuses resulting in symptoms,副鼻腔に炎症がおきる病気,Q183344
mpox,エムポックス,病気,viral disease,エムポックスウイルスへの感染を原因とする人獣共通感染症,Q382370
XYY syndrome,XYY症候群,病気,genetic condition in which a male has an extra Y chromosome,男児にY染色体が1本余分にある先天性染色体異常,Q267602
hypersexuality,異常性欲,病気,excessive arousal and interest in sex,量的または質的に異常な性欲,Q267907
Gerstmann-Straussler-Scheinker syndrome,ゲルストマン・ストロイスラー・シャインカー症候群,病気,"prion disease characterized by adult onset of memory loss, dementia, ataxia, and pathologic deposition of amyloid-like plaques in the brain",中枢神経の遺伝性疾患,Q383228
wart,イボ,病気,"small, rough growth resembling a cauliflower or a solid blister, often found on hands",皮膚や粘膜に生じる結節の総称,Q101971
rickets,くる病,病気,human disease,カルシウム・リン・ビタミンDなどの摂取不足・代謝異常によって、骨形成過程の石灰化が正常にならず、弱い骨となる病気,Q183392
yellow fever,黄熱,病気,viral disease,カが媒介するウイルス性出血熱,Q154874
actinomycosis,放線菌症,病気,Human disease,人間の病気,Q422268
dwarfism,小人症,病気,"condition affecting a person or animal short in stature, caused by slow or delayed growth",顕著な低身長を示す病態,Q194101
cardiac arrest,心停止,病気,sudden stop in effective blood flow due to the failure of the heart to contract effectively,心臓が有効な血液循環を保てない状態,Q202837
hydrocephalus,水頭症,病気,disorder characterized by an abnormal increase of cerebrospinal fluid in the ventricles of the brain,脳脊髄液が頭蓋腔内に貯まり、脳室が正常より大きくなる病気,Q193003
melancholia,メランコリー,病気,mood disorder of non-specific depression,日常的な用法では、はればれしない落ち込んだ気分のこと,Q192077
Lyme disease,ライム病,病気,"infectious disease caused by Borrelia bacteria, spread through the bite of blacklegged ticks",一種のスピロヘータの感染で引き起こされる人獣共通感染症の一つ,Q201989
Tourette syndrome,トゥレット症候群,病気,neurodevelopmental condition,多種類の運動チックと一種類以上の音声チックが1年以上続いている症状を特徴とする発達障害,Q191779
anogenital venereal wart,尖圭コンジローマ,病気,sexually transmitted disease,HPVによって感染する性行為感染症,Q208726
acrophobia,高所恐怖症,病気,phobia specific to heights,高い場所に対する恐怖症,Q207783
progeria,ハッチンソン・ギルフォード・プロジェリア症候群,病気,genetic disorder that causes early aging,先天的遺伝子異常を原因とする早老症のひとつ,Q213098
trench fever,塹壕熱,病気,human disease,グラム陰性細菌の一種であるバルトネラ・クインタナを原因菌とし、コロモジラミが媒介する感染症。第一次世界大戦中、塹壕内の兵士の間で流行した。約5日の間隔で発熱や悪寒を繰り返すことから、「五日熱」の異名を持つ,Q393477
psychomotor agitation,精神運動性激越,病気,a set of signs and symptoms that stem from mental tension and anxiety; the signs are unintentional and purposeless motions; the symptoms are emotional distress and restlessness,精神的な緊張や不安から生じる一連の兆候と症状。兆候は意図的でない無目的な動きであり、症状は感情的な苦痛と落ち着きのなさである。,Q394129
sleepwalking,睡眠時遊行症,病気,phenomenon of combined sleep and wakefulness,睡眠中にもかかわらず体動が出現しぼんやりと歩き回る症状,Q388626
savant syndrome,サヴァン症候群,病気,"psychological disorder that turns people to a megasavant, with a serious mental disorder",自閉症や知的障害の人のうち極稀に見られる、ある特定分野でのみ非常に優れた能力を示す症状,Q467265
decompression sickness,減圧症,病気,disorder caused by dissolved gases emerging from solution,減圧によって過飽和の状態となった生理的に不活性なガスの気泡が体内組織や血管に形成され引き起こされる障害,Q460591
dysgraphia,書字障害,病気,developmental or acquired neurological disorder,発達または後天的な神経学的状態,Q584560
pneumothorax,気胸,病気,abnormal collection of air in the pleural space,肺の疾患,Q203601
anti-NMDA receptor encephalitis,抗NMDA受容体抗体脳炎,病気,rare disease,急性型の脳炎,Q574719
Guillain–Barré syndrome,ギラン・バレー症候群,病気,autoimmune disease that causes the immune system to attack part of the peripheral nervous system,主に感染症をきっかけに発症する急性の炎症性多発神経障害であり、自己免疫反応による攻撃によって末梢神経根に炎症を引き起こす自己免疫疾患,Q205214
spinal muscular atrophy,脊髄性筋萎縮症,病気,rare congenital neuromuscular disorder,脊髄の運動ニューロン(脊髄前角細胞)の病変によって起こる 神経原性の筋萎縮を起こす先天性遺伝子疾患,Q580290
sciatica,坐骨神経痛,病気,medical condition with pain down the leg from the lower back,運動器領域の神経症状,Q565276
anorexia nervosa,神経性無食欲症,病気,type of eating disorder,痩せに対する執着・体重増加への極端な恐怖による低体重を特徴とする精神疾患,Q131749
hemophilia,血友病,病気,"human genetic disease that impairs the body's ability to make blood clots, a process needed to stop bleeding",血液凝固因子のうちVIII因子、IX因子の欠損ないし活性低下による遺伝性血液凝固異常症,Q134003
dyslexia,ディスレクシア,病気,specific learning disability characterized by troubles with reading,文字の読み書きに関する学習障害,Q132971
Edwards syndrome,エドワーズ症候群,病気,human disease,自然流産や生命予後など生存率が非常に厳しい、18番染色体の全部または一部分が3本ある染色体異常症,Q457737
Meniere's disease,メニエール病,病気,"disorder of the inner ear, characterized by potentially severe and incapacitating episodes of vertigo, tinnitus, hearing loss, and a feeling of fullness in the ear",内耳のリンパが増えて水ぶくれの状態となることで、激しい回転性のめまいと難聴・耳鳴り・耳閉感の4症状が同時に重なる症状を繰り返す疾患,Q460167
hysteria,ヒステリー,病気,"former diagnostic category describing a state of mind, one of unmanageable fear or emotional excesses",かつて「転換性障害・解離性障害」を一緒くたに意味した医学用語、または感情の自己抑制が効かず爆発的に激しい興奮・怒哀をむき出し状態を意味する俗語,Q144119
chlamydia infection,性器クラミジア感染症,病気,sexually transmitted infection caused by the bacterium Chlamydia trachomatis,クラミジア・トラコマチスが性交や性交類似行為によって、感染部位の粘膜との接触・分泌物との接触にで感染する性病,Q153356
foot-and-mouth disease,口蹄疫,病気,infectious and sometimes fatal viral disease that affects cloven-hoofed animals and caused by apthovirus,口蹄疫ウイルスによる家畜伝染病,Q152401
diphtheria,ジフテリア,病気,infectious disease,ジフテリア毒素によって起こる上気道の粘膜感染症,Q134649
floater,飛蚊症,病気,"deposits of various size, shape, consistency, refractive index, and motility within the eye's vitreous humour, which is normally transparent",視覚に発生する現象,Q142807
rubella,風疹,病気,human viral disease,風疹ウイルスにより伝染するウイルス感染症,Q155857
sleep paralysis,金縛り,病気,phenomenon,睡眠麻痺,Q486851
delirium,せん妄,病気,"severe confusion that develops quickly, and often fluctuates in intensity",一時的に意識障害・認知機能の低下などが生じる精神状態,Q160796
brucellosis,ブルセラ症,病気,Human and animal disease,ブルセラ属の細菌への感染で発症する人獣共通感染症,Q156050
ephebophilia,エフェボフィリア,病気,"sexual preference characterized by sexual attraction to adolescents, usually those in the range 15/16–18/19",15～19歳へ性的魅力を感じる性的嗜好,Q595012
Minamata disease,水俣病,病気,"a severe neurological disease caused by mercury poisoning, first discovered in the Japanese city of Minamata.",日本の公害病、メチル水銀による中毒性中枢神経系疾患,Q338857
heat stroke,熱射病,病気,"failure of the body to dissipate heat in an excessively hot environment, or during physical exertion",40℃を超える体温とせん妄を生じさせる重度の熱中症の一つ,Q337554
causes of schizophrenia,統合失調症の原因,病気,risk factors related to schizophrenia,統合失調症の発病因子と考えられる仮説・要素,Q490123
hepatitis A,A型肝炎,病気,acute infectious disease of the liver,食品が媒介するウイルス性肝炎,Q157661
experimental autoimmune encephalomyelitis,実験的自己免疫性脳脊髄炎,病気,Animal model of brain inflammation,脳炎の動物実験モデル,Q494066
aphakia,無水晶体症,病気,condition where the eye lacks a lens,水晶体が目にない状態,Q558623
earworm,イヤーワーム,病気,catchy piece of music that continually repeats through a person's mind after it is no longer playing,歌または音楽の一部分が心の中で強迫的に反復される現象,Q555631
apathy,アパシー,病気,state of indifference or the suppression of emotions; lack of interest or enthusiasm,感情がなくなった状態,Q309406
ichthyosis,魚鱗癬,病気,"skin disease in which dry, scaly skin accumulates",先天的、または後天的な皮膚病の一種,Q523893
Wilson disease,肝レンズ核変性症,病気,multisystem disease due to abnormal accumulation of copper,先天性銅代謝異常によって無機銅が代謝されずに蓄積し、大脳のレンズ核の変性と共に肝硬変・角膜輪等を生ずる疾患,Q117121
appendicitis,虫垂炎,病気,inflammation of the appendix,虫垂に炎症が起きている状態,Q121041
type-1 diabetes,1型糖尿病,病気,"autoimmune disease, a form of diabetes mellitus that occurs when insulin-producing cells are destroyed by the immune system",膵臓のインスリン産生細胞が自己免疫により破壊され、血糖値を下げる働きを持つインスリンの欠乏を原因とする、生活習慣とは無関係の糖尿病,Q124407
Williams-Beuren syndrome,ウィリアムズ症候群,病気,"neurodevelopmental disorder caused by a deletion of around 27 genes in chromosome 7, characterized by a broad forehead, underdeveloped chin, short nose, full cheeks, challenges with visual tasks, increased empathy and decreased aggression",まれな遺伝子疾患,Q558077
dysentery,赤痢,病気,inflammation of the intestine causing diarrhea with blood,下痢や血便を主症状とする大腸の感染症,Q129279
febrile seizure,熱性けいれん,病気,seizure associated with a high body temperature,温度が38°Cを超えると発生する発作,Q127664
neural tube defect,神経管閉鎖障害,病気,congenital disorder of the nervous system,無脳症や二分脊椎など妊娠初期に起こる神経管の形成障害で起こる胎児の先天異常,Q548213
anthrax,炭疽症,病気,infection caused by Bacillus anthracis bacteria,炭疽菌を病原体とする細菌感染症,Q129104
motion sickness,乗り物酔い,病気,condition in which a disagreement exists between visually perceived movement and the vestibular system's sense of movement,各種の乗り物が発する揺れなどによって、三半規管が刺激されることで起こる身体の諸症状,Q309067
myiasis,ハエ蛆症,病気,parasitic ectoparasitic infectious disease that is caused by parasitic dipterous fly larvae (maggots) feeding on the host's necrotic or living tissue,ハエの幼虫が生きた哺乳類の体内に侵入することによって発生する感染症,Q304601
Takayasu's arteritis,高安動脈炎,病気,"large vessel granulomatous vasculitis, massive intimal fibrosis and vascular narrowing.",大動脈に炎症が起こる自己免疫疾患,Q432462
intrusive thought,侵入思考,病気,"unwelcome involuntary thought, image, or unpleasant idea that may become an obsession",強迫的な性格を有する、望まない非自発的な思考、イメージ、不愉快な考え,Q1671614
ornithosis,オウム病,病気,disease,主に鳥類経由で気道感染症を引き起こす人獣共通感染症,Q164727
Q fever,Q熱,病気,disease caused by infection with Coxiella burnetii,人獣共通感染症の1つ,Q164818
Klinefelter's syndrome,クラインフェルター症候群,病気,human chromosomal condition,性分化疾患に分類される一連の症候群,Q207133
ciguatera,シガテラ,病気,foodborne illness,プランクトンが産生する毒素によって発生する食中毒のひとつ,Q181831
trichotillomania,抜毛症,病気,impulse control disorder with uncontrollable hair pulling,正常な毛を引き抜いてしまう精神障害のひとつ,Q608259
metastasis,転移,病気,spread of a disease inside a body,腫瘍細胞が原発病変とは違う場所に到達し、そこで再び増殖し、同一種類の腫瘍を二次的に生じること,Q181876
adult attention deficit hyperactivity disorder,大人のADHD,病気,the neurobiological condition of attention deficit hyperactivity disorder (ADHD) in adults,多動性のみ幼少期よりも改善した状態のADHD,Q1812920
necrophilia,屍姦,病気,"pathological attraction to dead bodies, especially sexual attraction or intercourse",死体と性交すること、または死体に欲情する性的嗜好のこと,Q181843
amyotrophic lateral sclerosis,筋萎縮性側索硬化症,病気,rare neurodegenerative disease with amyotrophy and progressive paralysis,筋肉の萎縮と筋力低下をもたらす神経変性疾患,Q206901
tularemia,野兎病,病気,"primary bacterial infectious disease that has material basis in Francisella tularensis, which is transmitted by dog tick bite (Dermacentor variabilis), transmitted by deer flies (Chrysops sp) or transmitted by contact with infected animal tissues.",野兎病菌Francisella tularensisを原因とする人獣共通感染症,Q153861
Sjögren's syndrome,シェーグレン症候群,病気,hypersensitivity reaction type II disease affecting the exocrine glands,自己免疫疾患の一つ,Q335555
survivor guilt,サバイバーズ・ギルト,病気,a mental condition that occurs when a person believes they have done something wrong by surviving a traumatic or tragic event when others did not,戦争や災害、事故、事件、虐待などから奇跡的に生還を遂げた人が「周りの人々が亡くなったのに自分が助かった」ことに対して感じる罪悪感,Q332768
abnormal kyphosis,脊椎後彎症,病気,abnormal convex curvature of the spine,人間の背中が丸まって内側へ反り、頭部が前方に出た姿勢になる現象,Q478389
bovine spongiform encephalopathy,牛海綿状脳症,病気,counterpart in cattle to variant Creutzfeldt-Jakob disease,感染症の一つ,Q154666
complex post-traumatic stress disorder,複雑性PTSD,病気,variant of post-traumatic stress disorder typically caused by ongoing abuse or stressful environment,長期反復的なトラウマ体験の後にしばしば見られる、感情などの調整困難を伴う心的外傷後ストレス障害,Q477502
yips,イップス,病気,condition of sudden skill or control loss in an athlete,主にスポーツの動作に支障をきたし、自分の思い通りの動きができなくなる症状,Q476373
conjunctivitis,結膜炎,病気,inflammation of the outermost layer of the eye and the inner surface of the eyelids,結膜にできる炎症,Q167844
Marburg virus disease,マールブルグ熱,病気,human disease,マールブルグウイルスを原因とする、人獣共通感染症,Q167264
scabies,疥癬,病気,human disease,ヒゼンダニの寄生により発症する皮膚感染症のひとつ,Q167178
phantom vibration syndrome,幻想振動症候群,病気,Perception that one's mobile phone is vibrating or ringing when it is not,スマートフォンなどに着信が無いが、着信があった時のように振動したと錯覚する現象,Q3242773
type 2 diabetes,2型糖尿病,病気,type of diabetes mellitus with high blood sugar and insulin resistance,高血糖症、インスリン抵抗性、相対的インスリン不足が特徴の長期的代謝異常,Q3025883
tennis elbow,テニス肘,病気,"condition caused by repetitive movements in which the outer elbow becomes sore and tender, sometimes involving inflammation or small tendon tears",テニスによって肘部に生じる疼痛性運動障害の総称,Q736776
Yushō disease,カネミ油症事件,病気,mass poisoning in Japan,1960年代に日本で発生した油症事件,Q359288
scarlet fever,猩紅熱,病気,human disease,連鎖球菌により媒介する発疹性の伝染病のひとつ,Q180266
burusera,ブルセラ,病気,"clothing paraphilia, sexualized attraction to the underwear or school uniforms",アダルトグッズとして流通する中古の学校用衣料品,Q2725587
1918-1920 flu pandemic,スペインかぜ,病気,1918–1920 global influenza pandemic caused by the H1N1 influenza A virus,1918～1919年に世界的に流行したインフルエンザ,Q178275
disorientation,失見当識,病気,psychopathological symptom,見当識を失った状態,Q1895873
conjoined twins,結合双生児,病気,twins physically joined in utero,体が結合している双生児,Q216866
adenocarcinoma,腺癌,病気,"carcinoma that has material basis in abnormally proliferating cells, derives from epithelial cells, which originate in glandular tissue",腺組織に由来する癌,Q356033
Abby and Brittany Hensel,アビゲイル&ブリタニー・ヘンゼル姉妹,病気,American conjoined twins,アメリカ合衆国の結合双生児,Q1639228
congenital rubella syndrome,先天性風疹症候群,病気,human disease,妊娠中の風疹ウイルス感染で生じ、胎児へ難聴・先天性心疾患・白内障などの先天性障害を発症させるウイルス感染症,Q1724539
strabismus,斜視,病気,eyes not aligning when looking at something,目の症状のひとつ,Q179951
asthenia,無力症,病気,symptom,筋力が弱くなる症状,Q633403
otitis media,中耳炎,病気,otitis which involves inflammation of the middle ear,中耳に炎症が起こる病気,Q223254
hypertrophy,肥大,病気,increase in the volume of an organ or tissue due to the enlargement of its component cells,組織あるいは器官が通常の容積よりも大きさを増した状態,Q216211
toxic epidermal necrolysis,中毒性表皮壊死症,病気,Severe skin reaction,全身の皮膚表皮が真皮と分離して重篤な感染症を招く皮膚障害。スティーブンス・ジョンソン症候群(SJS)と連続した概念。,Q1878682
