en_label,ja_label,category,en_description,ja_description,qid
hyper IgM syndrome,高IgM症候群,病気,primary immune deficiency disorders characterized by defective CD40 signaling,,Q1617658
echinococcosis,エキノコックス症,病気,parasitic disease of tapeworms of the Echinococcus type,,Q777087
Denys-Drash syndrome,デニス・ドラッシュ症候群,病気,Human disease,,Q774016
cerebral degeneration,脳変性,病気,human disease,,Q1620193
parasitic infectious diseases,寄生虫病,病気,infectious disease caused or transmitted by a parasite,,Q1601794
galactosemia,ガラクトース血症,病気,carbohydrate metabolic disorder that involves a defect in galactose metabolism resulting in toxic levels of galactose 1-phosphate in various tissues,,Q774483
Labial fusion,陰唇癒合,病気,human gynekological disease,,Q1640632
glycogen storage disease V,マッカードル病,病気,Human disease,,Q787751
Landau–Kleffner syndrome,ランドウ・クレフナー症候群,病気,a rare childhood neurological syndrome characterized by seizures and progressive loss of speech typically in a child with previous age-appropriate development,,Q1636310
animal trypanosomiasis,ナガナ病,病気,parasitic disease of vertebrates,,Q1617145
hirsutism,多毛症,病気,masculine hair growth on a woman,,Q1620594
CINCA syndrome,新生児期発症多臓器系炎症性疾患,病気,"Chronic Infantile Neurological, Cutaneous, and Articular (CINCA) syndrome is characterised by skin rash, joint involvement, chronic meningitis with granulocytes and, in some cases, sensorineural hearing loss and ocular signs",,Q779203
hypervolemia,循環血液量過多,病気,"increase in the volume of circulating blood, that is, an excess of fluid in the bloodstream",,Q1614115
hyperactivity,多動,病気,symptom,,Q1640850
Rasmussen's encephalitis,ラスムッセン脳炎,病気,rare inflammatory neurological disease,,Q1637701
cleidocranial dysplasia,鎖骨・頭蓋異形成症,病気,osteochondrodysplasia that has material basis in mutations in the RUNX2 gene which results in undeveloped or absent located in clavicle along with delayed closing of fontanels in the located in skull,,Q781618
polycoria,多瞳孔症,病気,pathological condition of the eye,,Q1638637
blackleg,気腫疽,病気,infectious bacterial disease,,Q699921
azotemia,高尿素窒素血症,病気,abnormally high levels of nitrogen in the blood,,Q794072
corticobasal degeneration,大脳皮質基底核変性症,病気,progressive neurodegenerative condition affecting the cerebral cortex and basal ganglia,,Q1755684
Common scab,そうか病,病気,Plant disease affecting potatoes and other crops,,Q1734637
deep vein thrombosis,深部静脈血栓症,病気,formation of a blood clot (thrombus) in a deep vein,,Q1762339
porcine proliferative enteropathy,ローソニア感染症,病気,,,Q1767508
chicken coccidiosis,鶏コクシジウム症,病気,,,Q1778997
Klippel–Trénaunay–Weber syndrome,クリッペル・トレノネー症候群,病気,syndrome that is characterized by large cutaneous hemangiomata with hypertrophy of the related bones and soft tissues,,Q1774750
Klippel-Feil syndrome,頸椎癒合症,病気,physical disorder that has material basis in abnormal segmentation of the vertebra during fetal development which results in fusion located in cervical vertebra,,Q1774751
tyrosinemia type I,高チロシン血症1型,病気,tyrosinemia that has material basis in deficiency of the enzyme fumarylacetoacetate hydrolase resulting in an increase in fumarylacetoacetate which inhibits previous steps in tyrosine degradation leading to an accumulation of tyrosine in the body,,Q1747726
microtia,小耳症,病気,congenital deformity where the pinna (external ear) is underdeveloped,,Q1759560
transposition of great vessels,大血管転位,病気,"group of congenital heart defects involving an abnormal spatial arrangement of any of the great vessels: superior and/or inferior venae cavae, pulmonary artery, pulmonary veins, and aorta",,Q1758730
progenism,下顎前突症,病気,malocclusion in which the mandible is anterior to the maxilla as reflected by the first relationship of the first permanent molar (mesioclusion),,Q3922672
uterus didelphys,子宮角癒合,病気,human disease,,Q3936703
galeophobia,サメ恐怖症,病気,fear of sharks,,Q3954707
fear of trains,鉄道恐怖症,病気,"anxiety and fear associated with trains, railways and railway travel",,Q3960151
cenesthopathy,体感症,病気,aberrant bodily sensation,,Q3919140
cytokine release syndrome,サイトカイン放出症候群,病気,bodily reaction,,Q3961647
driving phobia,自動車恐怖症,病気,fear of riding in a vehicle,,Q5308134
drugs in pregnancy,妊娠と薬,病気,potential harm or negative consequences to the fetus due to drugs and medications during pregnancy,,Q5308960
systemic scleroderma,全身性強皮症,病気,"scleroderma that is characterized by fibrosis (or hardening) of the skin and major organs, as well as vascular alterations, and autoantibodies",,Q5340515
ectoparasitism,外部寄生,病気,parasitic disease caused by organisms that live primarily on the surface of the host,,Q5334259
dyschromatosis symmetrica hereditaria,遺伝性対側性色素異常症,病気,"pigmentation disease characterized by progressively pigmented and depigmented macules, often mixed in a reticulate pattern, concentrated on the dorsal extremities",,Q5319366
Dunnigan familial partial lipodystrophy,ダニガン型家族性部分性リポジストロフィー,病気,medical condition,,Q5315596
brain herniation,脳ヘルニア,病気,disease,,Q1297985
Biddenden Maids,ビデンデンのおとめ,病気,conjoined twins,,Q1282404
bone neoplasm,骨腫瘍,病気,tumor or cancer located in bone tissue or specific bones,,Q1328805
empyema,蓄膿症,病気,gathering of pus within a naturally existing anatomical cavity,,Q1339539
tricuspid atresia,三尖弁閉鎖症,病気,tricuspid valve disease characterized by a missing or abnormally developed tricuspid heart value at birth,,Q1283303
konzo,コンゾ,病気,disease caused by malnutrition and high dietary cyanide intake,,Q1275814
Stargardt disease,スターガルト病,病気,age related macular degeneration that is characterized by progressive vision loss usually to the point of legal blindness,,Q1317319
Dupuytren's contracture,デュピュイトラン拘縮,病気,superficial fibromatosis arising from the soft tissue of the palm,,Q1330254
laryngospasm,喉頭痙攣,病気,disorder in which the adductor muscles of the vocal cords exhibit increased activity leading to laryngeal spasm,,Q1324592
parental alienation syndrome,片親引き離し症候群,病気,"term to describe a suite of behaviors in children, disputed by some members of the scientific community",,Q1334131
Pfeiffer syndrome,プファイファー症候群,病気,acrocephalosyndactylia that has material basis in mutations in the FGFR1 and FGFR2 gene which results in premature fusion located in skull,,Q1286848
demophobia,群衆恐怖症,病気,morbid fear of crowds or overcrowding,,Q1343559
school refusal,学校恐怖症,病気,anxiety or fear of school causing physical symptoms such as nausea and headaches,,Q1316515
cribbing,齰癖,病気,stable vice in horses,,Q1338862
Emery-Dreifuss muscular dystrophy,エメリー・ドレフュス型筋ジストロフィー,病気,muscular dystrophy that chiefly affects muscles used for movement (skeletal) and heart (cardiac) muscle,,Q1335642
paruresis,パーユリーシス,病気,shy bladder syndrome,,Q1335831
encephalitozoonosis,エンケファリトゾーン症,病気,Human disease,,Q1339986
Naxos disease,ナクソス病,病気,"Naxos disease is a recessively inherited condition with arrhythmogenic right ventricular dysplasia/cardiomyopathy (ARVD/C) and a cutaneous phenotype, characterised by peculiar woolly hair and palmoplantar keratoderma",,Q1332565
echopraxia,反響動作,病気,"catatonic behaviour, repetitive imitation of the movements of another person",,Q1280852
supraventricular tachycardia,上室性頻拍,病気,abnormally fast heart rhythm arising from improper electrical activity in the upper part of the heart,,Q1598909
spermaturia,精子尿症,病気,,,Q1593114
cutaneous larva migrans,皮膚幼虫移行症,病気,medical condition,,Q1597571
venous ulcer,静脈性潰瘍,病気,disease,,Q1573613
urea cycle disorder,尿素回路異常症,病気,amino acid metabolic disorder that involves a deficiency of one of the enzymes in the urea cycle which is responsible for removing ammonia from the blood stream,,Q1585743
trichophagia,食毛症,病気,medical condition,,Q1578799
urethral stricture,尿道狭窄,病気,"narrowing of the urethra caused by injury, instrumentation, infection and certain non-infectious forms of urethritis",,Q1585753
Tanganyika laughter epidemic,タンガニーカ笑い病,病気,1962 outbreak of mass hysteria,,Q1582992
arteriovenous malformation,動静脈奇形,病気,vascular anomaly,,Q1584110
microcytic anemia,小球性貧血,病気,human disease,,Q3298999
smut,黒穂菌,病気,reproductive structure of fungi,,Q3297002
HIV/AIDS in Swaziland,スワジランドにおけるHIV/AIDS,病気,HIV/AIDS in Swaziland,,Q3326318
ruminal tympany,第一胃鼓脹症,病気,cattle disease,,Q3333918
Muscardine,硬化病,病気,fungal disease of insects,,Q3328294
giant-cell tumor of the tendon sheath,腱鞘巨細胞腫,病気,Human disease,,Q2067052
peritoneal carcinomatosis,腹膜癌,病気,medical condition,,Q2071182
familial hemiplegic migraine,家族性片麻痺性片頭痛,病気,"migraine with aura that is characterized by temporary numbness or weakness, often affecting one side of the body",,Q3312899
hydrops-ectopic calcification-moth-eaten skeletal dysplasia,グリーンバーグ骨異形成症,病気,lethality and affected fetuses are considered as nonviable,,Q3335662
Bulbar palsy,球麻痺,病気,medical condition,,Q2060353
Still's disease,Still病,病気,,,Q3281303
misophonia,ミソフォニア,病気,"a disorder of decreased tolerance to specific sounds or stimuli associated with such sounds; these stimuli are experienced as unpleasant/distressing and tend to evoke strong negative emotional, physiological, and behavioural responses",,Q2054837
Scheie syndrome,シャイエ症候群,病気,"mucopolysaccharidosis characterized by corneal clouding, facial dysmorphism and normal lifespan",,Q3281299
mechanophilia,メカノフィリア,病気,sexual attraction to machines,,Q2057682
Phototoxicity,光毒性,病気,agent that renders the skin susceptible to damage (as sunburn or blisters) upon exposure to light and especially ultraviolet light,,Q2088972
human parainfluenza,ヒト・パラインフルエンザウイルス,病気,viruses that cause human parainfluenza,,Q2051533
eosinophilic esophagitis,好酸球性食道炎,病気,esophagitis characterized by inflammation involving eosinophils located in esophagus,,Q2057356
Extravasation,血管外漏出,病気,medical condition,,Q2051919
Patella bipartita,二分膝蓋骨,病気,medical condition,,Q2056680
hippopotomonstrosesquipedaliophobia,長い言葉恐怖症,病気,fear of long words,,Q3327213
complication of radiotherapy,放射線療法の副作用,病気,,,Q3281393
ephebiphobia,若者恐怖症,病気,fear of youth,,Q2076315
X-linked lymphoproliferative disease,X連鎖リンパ増殖性疾患,病気,lymphoproliferative disorder,,Q3281380
patent ductus arteriosus,動脈管開存症,病気,condition wherein the ductus arteriosus fails to close after birth,,Q2072063
"Niemann–Pick disease, type C",ニーマン・ピック病C型,病気,autosomal recessive lipid storage disorder that is characterized by accumulation of cholesterol and sphingomyelins in cells of the viscera and the central nervous system,,Q2067267
visceral larva migrans,内臓幼虫移行症,病気,medical condition,,Q3288116
postoperative nausea and vomiting,術後嘔気・嘔吐,病気,medical condition,,Q1658731
Nijmegen breakage syndrome,ナイミーヘン染色体不安定症候群,病気,human disease,,Q1250362
intercostal neuralgia,肋間神経痛,病気,,,Q1665961
Duane retraction syndrome,デュアン症候群,病気,a rare congenital disease characterized by external gaze palsy,,Q1262684
diphyllobothriasis,裂頭条虫症,病気,helminthiasis,,Q1227160
shoulder impingement syndrome,インピンジメント症候群,病気,"syndrome which occurs when the tendons of the rotator cuff muscles become irritated and inflamed as they pass through the subacromial space, the passage beneath the acromion",,Q1660341
Vogt–Koyanagi–Harada syndrome,原田病,病気,multisystem disease,,Q1238645
Doege–Potter syndrome,ドージ・ポッター症候群,病気,paraneoplastic syndrome,,Q1234529
pilomatrixoma,毛母腫,病気,Human disease,,Q1704531
Dressler's syndrome,ドレスラー症候群,病気,"pericarditis characterized by inflammation, occurring after injury, located in pericardium",,Q1258666
bacterial cold water disease,冷水病,病気,bacterial disease of salmonid fish,,Q1722736
hepatosplenomegaly,肝脾腫,病気,simultaneous enlargement of both the liver (hepatomegaly) and the spleen (splenomegaly),,Q1260186
Gardner's syndrome,ガードナー症候群,病気,congenital disorder of digestive system,,Q1702335
disease mongering,病気喧伝,病気,pejorative term for the practice of widening the diagnostic boundaries of illnesses and aggressively promoting their public awareness in order to expand the markets for treatment,,Q1228633
vascular occlusion,血管閉塞,病気,blockage of a blood vessel,,Q1248007
Dravet syndrome,ドラべ症候群,病気,epilepsy characterized by frequent febrile seizures and with onset before 1 year,,Q1255956
greasy pig disease,滲出性表皮炎,病気,,,Q1406349
familial adenomatous polyposis,家族性大腸腺腫症,病気,autosomal dominant disease that is has material basis in mutations in the APC gene and involves formation of numerous polyps in the epithelium of the large intestine which are initially benign and later transform into colon cancer,,Q1369011
sexual roleplay,性的ロールプレイ,病気,sexual and other interactions of people playing type roles,,Q1361427
monilethrix,連珠毛,病気,Human disease,,Q1363508
air embolism,空気塞栓,病気,vascular blockage by air bubbles,,Q1367304
hypertrophic cardiomyopathy,肥大型心筋症,病気,disease in which the heart muscle is enlarged,,Q1364270
heart conduction disease,心ブロック,病気,cardiovascular system disease that involves the heart's electrical conduction system,,Q1361515
fibular hemimelia,腓骨欠損,病気,congenital absence of the fibula,,Q1411024
Rapunzel syndrome,ラプンツェル症候群,病気,intestinal condition in humans resulting from ingesting hair,,Q1362494
vertebral subluxation,サブラクセーション,病気,chiropractic concept,,Q1362819
Phomopsis cane and leaf spot,デッド・アーム,病気,fungal plant disease,,Q1378999
granuloma inguinale,鼠径部肉芽腫,病気,sexually transmitted bacterial disease,,Q1416773
space motion sickness,宇宙酔い,病気,human disease,,Q1365937
tuberous sclerosis,結節性硬化症,病気,rare multisystem genetic disease that causes benign tumors to grow in the brain and on other vital organs,,Q1362721
downy mildew,べと病,病気,name for several species of fungus,,Q1394849
petechia,点状出血,病気,small red or purple spot on the skin or conjunctiva,,Q1412657
glycogen storage disease II,ポンペ病,病気,human disease,,Q1365789
hemophilia C,第XI因子欠乏症,病気,human disease,,Q1393718
factor XIII deficiency,第XIII因子欠乏症,病気,Human disease,,Q1393725
erythroderma,紅皮症,病気,skin disease,,Q1363741
patulous eustachian tube,耳管開放症,病気,eustachian tube disorder,,Q1361850
dental erosion,酸蝕症,病気,loss of tooth structure due to chemical dissolution by acids not of bacterial origin,,Q1361346
fibrodysplasia ossificans progressiva,進行性骨化性線維異形成症,病気,extremely rare connective tissue disease,,Q1410831
gluten-related disorder,グルテン関連障害,病気,set of diseases caused by gluten exposure,,Q1367782
polyarthritis,多発性関節炎,病気,type of arthritis which involves 5 or more joints simultaneously,,Q1274464
Hirschsprung's disease,ヒルシュスプルング病,病気,congenital disorder of digestive system,,Q1343645
Kostmann syndrome,重症先天性好中球減少症,病気,"group of diseases that affect myelopoiesis, causing a congenital form of neutropenia",,Q1337441
Alport syndrome,アルポート症候群,病気,"monogenic disease characterized by glomerulonephritis, endstage kidney disease, and hearing loss",,Q1331116
tension headache,緊張性頭痛,病気,common type of headache classified by The International Classification of Headache Disorders 3rd edition,,Q1338684
sitosterolemia,シトステロール血症,病気,rare autosomal recessively inherited lipid metabolic disorder,,Q1336034
myotonia,筋強直症候群,病気,prolonged contraction of muscles,,Q1277793
hypovolemia,循環血液量減少性ショック,病気,low blood volume,,Q1320276
empty sella syndrome,エンプティ・セラ症候群,病気,endocrine disease,,Q1339466
kink,キンク,病気,colloquial term for non-normative sexual behavior,,Q3815525
oxycephaly,尖頭症,病気,cephalic disorder where the top of the skull is pointed or conical due to premature closure of the coronal suture plus any other suture,,Q3813599
phagophobia,恐食症,病気,fear of swallowing,,Q3738366
MELAS syndrome,MELAS,病気,"one of the family of mitochondrial cytopathies, which also include MERRF, and Leber's hereditary optic neuropathy",,Q2666433
Lymphangiectasia,リンパ管拡張症,病気,pathologic dilation of lymph vessels,,Q3832889
Transient acantholytic dermatosis,一過性棘融解性皮膚症,病気,acantholytic,,Q3774229
primary effusion lymphoma,原発性滲出性リンパ腫,病気,"Primary effusion lymphoma (PEL) is a large B-cell lymphoma located in the body cavities, characterized by pleural, peritoneal, and pericardial fluid lymphomatous effusions and that is always associated with human herpes virus-8 (HHV-8)",,Q3832899
HIV/AIDS in Angola,アンゴラのHIV/AIDS,病気,,,Q3707403
HIV/AIDS in Uganda,ウガンダのHIV/エイズ,病気,,,Q3707404
tuberculous meningitis,結核性髄膜炎,病気,human disease,,Q3854687
junctional epidermolysis bullosa,接合部型表皮水疱症,病気,skin condition characterized by blister formation within the lamina lucida of the basement membrane zone,,Q3726862
dyskeratosis congenita,先天性角化異常症,病気,rare progressive congenital disorder with a highly variable phenotype,,Q3709312
hypoprothrombinemia,低プロトロンビン血症,病気,Human disease,,Q3801629
dyscrasia,血液疾患,病気,any of various disorders in medicine,,Q3709969
myoclonic dystonia,筋クローヌス性ジストニア,病気,"dystonia characterized by myoclonic jerks affecting mostly proximal muscles and dystonia, usually torticollis or writer's cramp, that typically responds to alcohol and has onset in the first of second decade of life",,Q3710440
Adolf Hitler's possible monorchism,アドルフ・ヒトラーの単精巣症の可能性,病気,overview about Adolf Hitler's possible monorchism,,Q4684101
adrenal fatigue,副腎疲労,病気,diagnosis of adrenal gland exhaustion,,Q4684712
angel wing,エンジェル・ウイング,病気,Disease of birds affecting wing shape,,Q4762346
aphallia,無陰茎症,病気,congenital variation in which the phallus (penis or clitoris) is absent,,Q4779465
Autosensitization dermatitis,自家感作性皮膚炎,病気,Disease of the skin,,Q4826986
airsickness,高度病,病気,Motion sickness induced by air travel,,Q4699003
amoebic gill disease,アメーバ性鰓病,病気,parasitic disease of marine fish,,Q4747466
alphavirus infections,アルファウイルス感染症,病気,disease class,,Q4735280
cutis laxa,皮膚弛緩症,病気,"skin disease characterized by skin that is loose, hanging, wrinkled and lacking in elasticity; it can also affect connective tissue in other parts of the body, including the heart, blood vessels, joints, intestines and lungs",,Q2735907
"48,XXXX syndrome",XXXX症候群,病気,rare chromosomal disorder with 4 X chromosomes,,Q2758894
familial hypercholesterolemia,家族性高コレステロール血症,病気,familial hyperlipidemia characterized by very high levels of low-density lipoprotein (LDL) and early cardiovascular disease,,Q2711291
mysophobia,潔癖,病気,pathological fear of contamination and germs,,Q1423683
autosomal dominant polycystic kidney,常染色体優性多発性嚢胞腎,病気,human disease,,Q2732398
Pallister–Killian syndrome,パリスター・キリアン症候群,病気,rare disease,,Q1425018
Fraser syndrome,フレイザー症候群,病気,autosomal recessive congenital disorder,,Q1425572
opsoclonus myoclonus syndrome,眼球クローヌス・ミオクローヌス運動失調,病気,rare disease,,Q1424706
Tarantism,タランティズム,病気,1500s and 1600s outbreak,,Q2754884
enterohaemorrhagic Escherichia coli infection,出血性大腸炎,病気,Human disease,,Q1344603
lymph node metastasis,リンパ節転移,病気,The spread of a malignant neoplasm to the lymph nodes,,Q2774221
thrombotic thrombocytopenic purpura,血栓性血小板減少性紫斑病,病気,human disease,,Q1426491
epizootic ulcerative syndrome,真菌性肉芽腫症,病気,disease caused by the water mould Aphanomyces invadans,,Q2691562
eye injury,眼外傷,病気,medical condition,,Q2681162
ergophobia,仕事恐怖症,病気,abnormal and persistent fear of work or fear of finding employment,,Q2724163
arachnoiditis,クモ膜炎,病気,Human disease,,Q2669284
Huanglongbing,カンキツグリーニング病,病気,disease impacting citrus fruit spread via insects on an international scale,,Q2745134
Albright's hereditary osteodystrophy,オルブライト遺伝性骨異栄養症,病気,"osteochondrodysplasia that has material basis in lack of responsiveness to parathyroid hormone which results in shortening and widening of long bones of the located in hand or located in foot along with short stature, obesity, and rounded face",,Q4712685
aposthia,先天性無包皮,病気,congenital condition in humans where the foreskin is missing,,Q4780588
auditory neuropathy,オーディトリー・ニューロパシー,病気,"hearing disorder characterized by impaired transmission of signals through the auditory nerve, resulting in mild to severe hearing loss and poor speech perception",,Q4820036
anopsia,視野障害,病気,medical condition,,Q4770152
Aromatase deficiency,アロマターゼ欠乏症,病気,medical condition,,Q4795506
aromatase excess syndrome,アロマターゼ過剰症候群,病気,human disease,,Q4795508
Dancing Plague of 1518,舞踏のペスト,病気,16th century mass dancing mania in Strasbourg,,Q3295141
fear of fish,魚恐怖症,病気,fear of traditional and non traditional fishes,,Q3321265
skin infection,皮膚感染症,病気,"skin disease caused by bacteria, fungi, parasites or virus",,Q2458539
tunnel vision,視野狭窄,病気,medical condition,,Q2460147
reticular erythematous mucinosis,網状紅斑性ムチン沈着症,病気,medical condition,,Q2466106
Donohue syndrome,ドナヒュー症候群,病気,Human disease,,Q2467739
familial amyloid neuropathy,家族性アミロイドポリニューロパチー,病気,human disease,,Q3338677
postterm pregnancy,過期産,病気,"when a pregnant person has not yet delivered after 42 weeks of gestation, two weeks beyond the typical 40-week duration",,Q3399863
chorea-acanthocytosis,神経有棘赤血球症,病気,Human disease,,Q3338656
nosocomephobia,病院恐怖症,病気,excessive fear of hospitals,,Q3344353
Southeast Asian ovalocytosis,東南アジア楕円赤血球症,病気,medical condition,,Q3358864
osteoradionecrosis,放射線性骨壊死,病気,disease,,Q3357479
parvovirus infectious disease,パルボウイルス感染症,病気,human and animal diseases,,Q3367106
amnesic shellfish poisoning,記憶喪失性貝中毒,病気,syndrome of shellfish poisoning,,Q3398781
Columnaris,カラムナリス病,病気,bacterial infection of fish,,Q3400643
defective interfering particle,欠陥干渉粒子,病気,defective mutant viral genomes and particles which are incompetent in independent replication and interfere with normal virus replication,,Q5251124
crystal arthropathy,結晶性関節症,病気,Human disease,,Q5191403
craniofacial disease,頭蓋顔面,病気,human disease,,Q5182134
cyclic hematopoiesis,周期性好中球減少症,病気,Human disease,,Q5198214
distal muscular dystrophy,遠位型ミオパチー,病気,"group of genetic disorders characterized by progressive muscular atrophy and muscle weakness beginning in the hands, the legs, or the feet",,Q5282843
Dubin-Johnson syndrome,デュビン・ジョンソン症候群,病気,"rare, autosomal recessive, benign disorder that causes an isolated increase of conjugated bilirubin in the serum",,Q1263039
dyschezia,排便障害,病気,difficult defecation,,Q1269235
atrial flutter,心房粗動,病気,abnormal heart rhythm that starts in the atrial chambers of the heart,,Q1506572
nemaline myopathy,ネマリンミオパチー,病気,congenital structural myopathy characterized by generally non-progressive muscle weakness of varying severity,,Q1507379
rapidly progressive glomerulonephritis,急速進行性糸球体腎炎,病気,human disease,,Q1509367
phlebotomus fever,サシチョウバエ熱,病気,human disease,,Q1813747
genophobia,性交恐怖症,病気,fear of sexual relations or sexual intercourse,,Q2275605
metrorrhagia,子宮出血,病気,uterine bleeding between menstrual periods,,Q1268495
