qid,category_en,category_ja,category_qid,en_label,ja_label,en_description,ja_description,mesh_id,icd10,icd9,snomed_id,umls_id
Q21993812,symptom,症状,Q169872,chronic nausea,,,,,,,,
Q22314576,symptom,症状,Q169872,cold skin,,,,,,,,
Q22965464,symptom,症状,Q169872,hypercrinia,,,,,,,,
Q22965448,symptom,症状,Q169872,Collet's syndrome,,,,,,,,C0270885
Q21515327,symptom,症状,Q169872,distractibility,転導性,psychopathological symptom (difficulty focusing on tasks),精神病理学的症状の一種。気が散りやすいこと,,,,,C0233415
Q21515328,symptom,症状,Q169872,erratic behavior,,symptom,,,,,,C0564572
Q17063412,symptom,症状,Q169872,Sinbyeong,巫病,Korean culture-bound syndrome,,,,,,
Q937353,symptom,症状,Q169872,echolalia,反響言語,speech disorder that involves the automatic repetition of vocalizations made by another person,他者の言葉をそのまま繰り返して真似る行為,D004454,R48.8,784.69,,C0013528
Q11782024,symptom,症状,Q169872,miryachit,,"nervous disorder said to have been encountered in Siberia, characterized by a jumping tic and the involuntary imitation of the words and actions of other people",,,,,,
Q11794732,symptom,症状,Q169872,Erb's phenomenon,,Symptom of tetanus,,,,,,
Q1162276,symptom,症状,Q169872,xerostomia,口腔乾燥症,medical condition,,D014987,K11.7,527.7,,C0043352
Q676691,symptom,症状,Q169872,Eskimo words for snow,,Linguistic cliché,,,,,,
Q10786647,symptom,症状,Q169872,alveolar fluid,,,,,,,,
Q555631,symptom,症状,Q169872,earworm,イヤーワーム,catchy piece of music that continually repeats through a person's mind after it is no longer playing,歌または音楽の一部分が心の中で強迫的に反復される現象,,,,,
Q11820606,symptom,症状,Q169872,eye irritation,目の炎症,irritation of the eye,,,,,,C0235266
Q942936,symptom,症状,Q169872,witches' mark,,Hypothetical mark on the body indicating a person was a witch,,,,,,
Q6771095,symptom,症状,Q169872,Markle's sign,,medical condition,,,,,,
Q936070,symptom,症状,Q169872,trismus,牙関緊急,medical problem of jaw clenching,,D014313,R25.2,781.0,,C0041105
Q11919412,symptom,症状,Q169872,enteralgia,,,,,,,,C1557475
Q1631866,symptom,症状,Q169872,ego disturbance,,,,,,,,
Q918193,symptom,症状,Q169872,catalepsy,カタレプシー,"psychomotor symptom of catatonia, abnormal maintenance of postures",受動的にとらされた姿勢を保ち続け、自分の意思で変えようとしない状態,D002375,F44.2,295.2,,C0007370
Q18343527,symptom,症状,Q169872,gastrointestinal distress,,symptom,,,,,,C0232459
Q11789590,symptom,症状,Q169872,psychomotor drive,,,,,,,,
Q122442106,symptom,症状,Q169872,Post-acute infection syndrome,,chronic illnesses from infections,,,,,,
Q124957451,symptom,症状,Q169872,Klingsor syndrome,クリングゾル症候群,medical syndrome,,,,,,
Q122890759,symptom,症状,Q169872,Jansen-de Vries syndrome,,human disease,,,,,,
Q119573587,symptom,症状,Q169872,trauma in the Russian invasion of Ukraine,2022年ロシアのウクライナ侵攻におけるトラウマ,,,,,,,
Q120691243,symptom,症状,Q169872,Hao–Fountain syndrome,,genetic syndrome,,,,,,
Q120939453,symptom,症状,Q169872,FOXP1 syndrome,,genetic syndrome,,,,,,
Q117768481,symptom,症状,Q169872,ear foreign body,,foreign body in the external auditory canal,,,,,,
Q31813,symptom,症状,Q169872,Plummer–Vinson syndrome,,syndrome,,D011004,D50.1,280.8,,C0032249
Q115943837,symptom,症状,Q169872,asystole during REM sleep,,,,,,,,
Q116182304,symptom,症状,Q169872,Post-Avatar depression syndrome,,,,,,,,
Q118185652,symptom,症状,Q169872,syndrome of Lisistrate,,,,,,,,
Q120708755,symptom,症状,Q169872,Raymond syndrome,,,,,,,,
Q120728858,symptom,症状,Q169872,Bonnevie-Ullrich syndrome,,,,,,,,
Q4869729,symptom,症状,Q169872,battered woman syndrome,,pattern of signs and symptoms displayed by a woman who has suffered persistent intimate partner violence,,,T74.1,995.81,,
Q5445919,symptom,症状,Q169872,Fetal trimethadione syndrome,胎児トリメタジオン症候群,medical condition,,C537798,,,,C0265373
Q4737896,symptom,症状,Q169872,Alvarez' syndrome,,medical condition,,,,,,
Q3961674,symptom,症状,Q169872,Filippi syndrome,,,,C538152,,,,C0795940
Q467265,symptom,症状,Q169872,savant syndrome,サヴァン症候群,"psychological disorder that turns people to a megasavant, with a serious mental disorder",自閉症や知的障害の人のうち極稀に見られる、ある特定分野でのみ非常に優れた能力を示す症状,,,315.8,,C2316458
Q1287833,symptom,症状,Q169872,general adaptation syndrome,,,,,,,,
Q5852896,symptom,症状,Q169872,plant necrosis,,,,,,,,
Q497841,symptom,症状,Q169872,colony collapse disorder,蜂群崩壊症候群,poorly-understood phenomenon causing decline in bee populations,ミツバチが原因不明で大量に失踪する現象,,,,,
Q1097957,symptom,症状,Q169872,intermittent claudication,間欠跛行,"symptom that describes muscle pain on mild exertion (ache, cramp, numbness or sense of fatigue)",,D007383,,440.21,,C0021775
Q1431371,symptom,症状,Q169872,Frey syndrome,フライ症候群,human disease,,,,,,C0038994
Q5424297,symptom,症状,Q169872,FACES syndrome,,human disease,,C536384,,,,C2931183
Q12680516,symptom,症状,Q169872,jaw pain,,,,,,,,
Q1115038,symptom,症状,Q169872,runny nose,鼻漏,type of medical symptom where the nasal cavity is filled with fluid mucus,,D000086722,J34.8,478.19,,C1260880
Q5121708,symptom,症状,Q169872,circulatory collapse,循環虚脱,"failure of circulation, such as blood flow",,,R57.9,,,C0852026
Q1244963,symptom,症状,Q169872,Dorian Gray syndrome,ドリアン・グレイ症候群,psychic syndrome,,,,,,
Q1334131,symptom,症状,Q169872,parental alienation syndrome,片親引き離し症候群,"term to describe a suite of behaviors in children, disputed by some members of the scientific community",,,,,,
Q5419936,symptom,症状,Q169872,executive disfunction,遂行機能障害,"difficulty with accessing executive functions such as organization, planning ahead, and self-monitoring",目標設定・そのプロセスの計画・効果的行動が出来なくなる高次脳機能障害の一種,,,,,C2748208
Q1422966,symptom,症状,Q169872,Wartenberg's Syndrome,,medical condition,,,,,,CL515417
Q5358728,symptom,症状,Q169872,Griscelli syndrome type 1,,"Griscelli syndrome characterized by silvery gray sheen of the hair, hypopigmentation of the skin and neurological impairment without immunodeficiency that has material basis in mutations in the MYO5A gene on chromosome 15q21.2",,C537301,,,,C1859194
Q7161793,symptom,症状,Q169872,pelvic congestion syndrome,,human disease,,,,,,C0152078
Q129279,symptom,症状,Q169872,dysentery,赤痢,inflammation of the intestine causing diarrhea with blood,下痢や血便を主症状とする大腸の感染症,D004403,A03.9,,,C0013369
Q6744445,symptom,症状,Q169872,malnutrition–inflammation complex,,common condition in chronic disease states such as chronic kidney disease,,,,,,
Q5283089,symptom,症状,Q169872,distress,苦悩,difficult state in which a person is unable to completely adapt to stressors and their resulting stress and shows maladaptive behaviors,,D000079225,,,,C0231303
Q4173417,symptom,症状,Q169872,otosalpingitis,,"eustachian tube disorder which involves inflammation of the mucous membrane of the cartilagenous portion of the eustachian tube caused by acute nasopharyngitis, infection from some pathogenic microbes or trauma of the tube",,,,,,C0155428
Q7256456,symptom,症状,Q169872,psychoorganic syndrome,器質精神症候群,"disorder characterised by impairment of memory, thought disorders etc., due to diffuse psychoorganic brain damage",,,F07.9,310.1,,
Q1041258,symptom,症状,Q169872,West syndrome,点頭てんかん,"severe epilepsy syndrome with infantile spasms, hypsarrhythmia and mental retardation",,,G40.4,345.6,,
Q5526827,symptom,症状,Q169872,Gastrocutaneous syndrome,,human disease,,C535651,,,,C1850899
Q1090833,symptom,症状,Q169872,Heyde's syndrome,,medical condition,,,I35.0,,,
Q2467856,symptom,症状,Q169872,Agony in the Garden,ゲツセマネの祈り,episode from the life of Jesus Christ,イエス・キリストがゲツセマネの園で十字架刑に処せられる前夜に祈った祈り,,,,,
Q2208086,symptom,症状,Q169872,TORCH complex,TORCH症候群,medical condition,,,,,,C0270173
Q4894912,symptom,症状,Q169872,berserk llama syndrome,ベルセルク・ラマ症候群,psychological condition suffered by human-raised llamas and alpacas,,,,,,
Q3746560,symptom,症状,Q169872,phlegm,痰,liquid secreted by the mucous membranes of mammalians,,,,,,
Q1020201,symptom,症状,Q169872,Böök syndrome,,disease,,C562993,Q82.4,,,C0457014
Q6817452,symptom,症状,Q169872,mental distress,精神的苦痛,"range of symptoms and experiences of a person's internal life that are commonly held to be troubling, confusing or out of the ordinary",,,,,,
Q12643772,symptom,症状,Q169872,heat exhaustion,熱疲労,caused by the loss of water and electrolytes through sweating,,D006359,,,,C0018839
Q1642118,symptom,症状,Q169872,hemoblastosis,,abnormal proliferation of hematoblasts,,,,,,
Q3804556,symptom,症状,Q169872,lamellar ichthyosis,層状魚鱗癬,disease,,D017490,Q80.2,,,C4551630
Q12101178,symptom,症状,Q169872,discomfort,,unpleasant physical feeling,,,,,,C0234215
Q5513797,symptom,症状,Q169872,GMS syndrome,,medical condition,,C564214,,,,C1841854
Q1088113,symptom,症状,Q169872,chronic pain,慢性疼痛,acute pain extending beyond the usual healing process,,D059350,G89.4,338.2,,C0150055
Q1022718,symptom,症状,Q169872,CADASIL,,autosomal dominant cerebrovascular disorder characterized by recurrent subcortical ischemic stroke and cognitive impairment,,D046589,,,,C0751587
Q4653007,symptom,症状,Q169872,ANOTHER syndrome,,human disease,,C565604,,,,C1857052
Q5141203,symptom,症状,Q169872,cognitive deficit,認知障害,medical condition,,,,,,
Q1349829,symptom,症状,Q169872,affluenza,金満病,negative socio-psychological effects of consumerism,,,,,,
Q1208144,symptom,症状,Q169872,boreout,,psychological disorder,,,,,,
Q1389389,symptom,症状,Q169872,Feline odontoclastic resorptive lesion,,syndrome,,,,,,
Q7305419,symptom,症状,Q169872,Red wine headache,,headache often accompanied by nausea and flushing,,,,,,
Q5151412,symptom,症状,Q169872,Comedown,,Feelings after a drug's effects are fading,,,,,,
Q959457,symptom,症状,Q169872,syndrome of Inappropriate antidiuretic hormone secretion,抗利尿ホルモン不適合分泌症候群,endocrine disease,症候群の一つ,D007177,E22.2,253.6,55004003,C0021141
Q6508875,symptom,症状,Q169872,Leaf spot,斑点性病害,leaf disease caused by fungal pathogen,植物の葉に病斑を形成する病害の総称,,,,,
Q5429401,symptom,症状,Q169872,Faget sign,,pairing of fever with bradycardia,,,,,,
Q12719169,symptom,症状,Q169872,Tufse,,Synonymous with fear,,,,,,
Q7669314,symptom,症状,Q169872,TAN syndrome,,medical condition,,,,,,
Q108842750,symptom,症状,Q169872,Zaki syndrome,,rare genetic syndrome caused by a mutation in WLS gene,,,,,,
Q108844085,symptom,症状,Q169872,facial dermal dysplasia type 1,,,,,,,,C2936827
Q111487708,symptom,症状,Q169872,low anterior resection syndrome,,postoperative complication after removal of the rectum,,D000094123,,,,C4524073
Q113173062,symptom,症状,Q169872,Forbes-Albright syndrome,,syndrome which cause galactorrhea and amenorrhoea,,,,,,
Q113360718,symptom,症状,Q169872,Plank,,"fictional character (imaginary friend) from Ed, Edd n Eddy",,,,,,
Q111211783,symptom,症状,Q169872,Brachycephalic Airway syndrome,,,,,,,,
Q112156204,symptom,症状,Q169872,trance-like syndrom,,,,,,,,
Q112683260,symptom,症状,Q169872,multiple chemical sensitivity syndrome,,,,,,,,
Q113976361,symptom,症状,Q169872,Post-Vac,,,,,,,,
Q57769952,symptom,症状,Q169872,catatonic excitement,,"catatonic symptom, purposeless and excited motor activity without obvious cause",,,,295.2,,C0233606
Q93629491,symptom,症状,Q169872,pediatric multisystem inflammatory syndrome,小児発症性多系統炎症症候群,"systemic inflamation in children, connected to COVID-19",小児にみられる重度炎症性疾患の一種,,,,,
Q97368664,symptom,症状,Q169872,Mediterranean syndrome,,,,,,,,
Q106590153,symptom,症状,Q169872,New Brunswick suspected neurological disease,,possible degenerative disease,,,,,,
Q29589522,symptom,症状,Q169872,salmon-colored rash,サーモンピンク疹,,成人Still病において発熱と同時に現れるサーモンピンク色の紅斑。掻痒感はなく、解熱と同時に消退する。,,,,,
Q29643911,symptom,症状,Q169872,Action tremor,,"tremor present when the limbs are active, either when outstretched in a certain position or throughout a voluntary movement",,,,,,
Q55785903,symptom,症状,Q169872,syndrome with corpus callosum agenesis /dysgenesis as a major feature,,human disease,,,,,,C5680521
Q55786882,symptom,症状,Q169872,syndrome with pulmonary hypertension as a major feature,,human disease,,,,,,C5680755
Q29789635,symptom,症状,Q169872,encephalitic cry,,crying caused by encephalitis,,,,,,
Q64513386,symptom,症状,Q169872,bulimia nervosa,神経性大食症,eating disorder that is characterized by a cycle of bulimia (binge eating) followed by inappropriate acts such as purging to avert weight gain,過食と、それによる体重増加を避けるための嘔吐などの不適切行為の繰り返しを特徴とする摂食障害・精神疾患,D002032,F50.2,307.51,,C0006370
Q28403848,symptom,症状,Q169872,Hutchinson's mask,,,,,,,,
Q56036868,symptom,症状,Q169872,Pick symptom,,diagnostic symptoms at Sand Fly Fever,,,,,,
Q30141302,symptom,症状,Q169872,confusion with time and space,,,,,,,,
Q30141343,symptom,症状,Q169872,challenges in planning or solving problems,,,,,,,,
Q56063104,symptom,症状,Q169872,racial trauma,,race-based traumatic stress; the cumulative effects of racism on an individual’s mental and physical health,,,,,,
Q56104212,symptom,症状,Q169872,Ferrari sign,,symptom of yellow fever,,,,,,
Q72423832,symptom,症状,Q169872,autistic meltdown,自閉症のメルトダウン,involuntary emotional breakdown in an autistic person caused by severe stress,,,,,,
Q56233069,symptom,症状,Q169872,tetanus triad,,triad of symptoms,,,,,,
Q56233235,symptom,症状,Q169872,spatula test,,symptom in tetanus,,,,,,
Q85846769,symptom,症状,Q169872,Neck-tongue syndrome,,medical disorder,,,,,,
Q54366503,symptom,症状,Q169872,Temtamy syndrome,,"Temtamy syndrome is a very rare congenital genetic neurological disorder characterized by agenesis/hypoplasia of corpus callosum with developmental abnormalities, ocular disorders, and variable craniofacial and skeletal abnormalities",,C536959,Q87.8,,,C1857512
Q97365310,symptom,症状,Q169872,autistic burnout,自閉燃え尽き症,persisting state of exhaustion in autistic people,,,,,,
Q55345654,symptom,症状,Q169872,craniosynostosis-Dandy-Walker malformation-hydrocephalus syndrome,,medical condition,,,,,,C1838347
Q28455110,symptom,症状,Q169872,emotional lability,気分変動,medical symptom,,,,,,
Q96278437,symptom,症状,Q169872,non-restorative sleep,,unrefreshing sleep,,,,,,
Q58145981,symptom,症状,Q169872,apragmatism,,state of inactivity caused by schizophrenia or severe depression,,,,,,C4049568
Q66424263,symptom,症状,Q169872,Fragments: Memories of a Wartime Childhood,,faked Holocaust memoir / false autobiography (confabulation) by Binjamin Wilkomirski (pseudonym),,,,,,
Q66424104,symptom,症状,Q169872,Wilkomirski syndrome,,Non-Jews present as Jewish Holocaust survivors,,,,,,
Q106937541,symptom,症状,Q169872,Sandestig-Stefanova syndrome,,,,,,,,
Q96693925,symptom,症状,Q169872,Post-Treatment Lyme Disease,,Lyme disease symptoms persisting after treatment,,D000077342,,,,C3890422
Q67135649,symptom,症状,Q169872,autistic special interest,,narrow and passionate interest experienced by autistic people that can spark positive feelings,,,,,,
Q67135693,symptom,症状,Q169872,rejection sensitive dysphoria,,strong emotional response to perceived rejection typically seen in people with ADHD,,,,,,
Q16866863,symptom,症状,Q169872,Skin sloughing,,shedding dead surface cells off the skin,,,,,,CL454356
Q20182872,symptom,症状,Q169872,Curtius syndrome,,,,,,,,
Q18554603,symptom,症状,Q169872,anterior scleritis,,Human disease,,,,,,C0155353
Q11741987,symptom,症状,Q169872,Small Penis Syndrome,,unreasonable belief that the penis size is below normal,,,,,,
Q9390205,symptom,症状,Q169872,ADULT syndrome,,rare human genetic disease,,C538052,,,,C1863204
Q9390211,symptom,症状,Q169872,branchiooculofacial syndrome,,"autosomal dominant disease that is characterized by low birth weight and growth retardation, bilateral branchial clefts",,,,,449821007,C0376524
Q11976536,symptom,症状,Q169872,Hearing damage,,,,,,,,
Q12057961,symptom,症状,Q169872,John Wayne Syndrome,,,,,,,,
Q11492730,symptom,症状,Q169872,nasake wa hito no tame narazu,情けは人の為ならず,,日本語のことわざ,,,,,
Q9390244,symptom,症状,Q169872,Guérin-Stern syndrome,,,,,,,,
Q11696796,symptom,症状,Q169872,isotretinoin embryopathy,,,,C535670,,,,C0432364
Q8963032,symptom,症状,Q169872,flight of ideas,,"a nearly continuous flow of thoughts, usually manifested in excessive speech",,,,,,C0233657
Q11347550,symptom,症状,Q169872,lunchmate syndrome,ランチメイト症候群,fear of eating alone,,,,,,
Q9390241,symptom,症状,Q169872,Genoa syndrome,,,,C537684,,,,C1832424
Q11787725,symptom,症状,Q169872,overvalued idea,,an unreasonable and sustained belief which is preoccupying to the extent of dominating the person's life,,,,,,C0233668
Q9395395,symptom,症状,Q169872,Rodrigues blindness,,,,C535865,,,,C1849332
Q9081119,symptom,症状,Q169872,Fetal valproate spectrum disorder,,rare disease caused by prenatal exposure to valproic acid (VPA),,C536525,,,,C0236026
Q754348,symptom,症状,Q169872,infant respiratory distress syndrome,新生児呼吸窮迫症候群,human disease affecting newborns,,D006819,,769,,C0020192
Q175918,symptom,症状,Q169872,SSRI discontinuation syndrome,SSRI離脱症候群,"condition that can occur following the interruption, dose reduction, or discontinuation of antidepressant drugs, including selective serotonin re-uptake inhibitors (SSRIs) or serotonin–norepinephrine reuptake inhibitors (SNRIs)",,,,,,CL777146
Q368779,symptom,症状,Q169872,insect-inflicted wound,虫刺症,wound caused by the bite or sting of an insect,,D007299,T14.1,919.4,,
Q195961,symptom,症状,Q169872,false memory syndrome,過誤記憶,syndrome,,,,,,
Q613809,symptom,症状,Q169872,Kleine-Levin syndrome,クライン・レビン症候群,recurrent hypersomnia that is characterized by recurring periods of excessive amounts of sleep and altered behavior,,D017593,G47.8,327.13,,C0206085
Q1269237,symptom,症状,Q169872,dyschylia,,,,,,,,
Q1198115,symptom,症状,Q169872,stereotypy,常同行動,repetitive mechanical repetition of speech or physical activities,,D013239,,307.3,,C0038271
Q136783,symptom,症状,Q169872,magical thinking,呪術的思考,"illogical conclusions based on correlated events, or belief that unrelated events are causally connected despite the absence of any plausible causal link between them",,,,,,
Q1077589,symptom,症状,Q169872,Peter Pan syndrome,ピーターパン症候群,syndrome,「大人という年齢に達しているが精神的に大人になれない男女」を表す概念,,,,,
Q653197,symptom,症状,Q169872,rash,皮疹,skin condition,,,R21,,,C0015230
Q1324592,symptom,症状,Q169872,laryngospasm,喉頭痙攣,disorder in which the adductor muscles of the vocal cords exhibit increased activity leading to laryngeal spasm,,D007826,J38.5,478.75,,C0023066
Q1480291,symptom,症状,Q169872,contracture,拘縮,"prolonged shortening of the muscle or other soft tissue around a joint, preventing movement of the joint",,D003286,M24.5,728.6,57048009,C0009917
Q998803,symptom,症状,Q169872,tumor lysis syndrome,腫瘍崩壊症候群,medical condition,,D015275,E88.3,277.88,,C0041364
Q1338862,symptom,症状,Q169872,cribbing,齰癖,stable vice in horses,,,,,,
Q624497,symptom,症状,Q169872,altitude sickness,高山病,acute negative health effects from high altitude,,D000532,T70.2,993.2,,C0002351
Q1452495,symptom,症状,Q169872,Stadtaffe,,album,ペーター・フォックスのアルバム,,,,,
Q1421961,symptom,症状,Q169872,idée fixe,観念固着,an idea that preoccupies an individual and that he is unwilling to give up despite evidence to the contrary,,,,,,
Q642548,symptom,症状,Q169872,hepatic encephalopathy,肝性脳症,"brain disease that is characterized by loss of brain function, the occurrence of confusion, altered level of consciousness, and coma that results when the liver is unable to remove toxins from the blood",,D006501,,,,C0019151
Q1335193,symptom,症状,Q169872,diabetic embryopathy,,characterized by congenital anomalies or foetal/neonatal complications in an infant that are linked to diabetes in the mother,,,,,,C3830518
Q935710,symptom,症状,Q169872,mitochondrial disease,ミトコンドリア病,spontaneously occuring or inherited disorder that involves mitochondrial dysfunction,,D028361,,277.87,240096000,C0751651
Q178061,symptom,症状,Q169872,shock,ショック,medical condition of insufficient blood flow to the tissues of the body,,D012769,R57,785.50,,C0036974
Q605576,symptom,症状,Q169872,May–Thurner syndrome,,mechanical problem where the left iliac vein is compressed by the right iliac artery,,D062108,I87.1,,,C3165062
Q1361850,symptom,症状,Q169872,patulous eustachian tube,耳管開放症,eustachian tube disorder,,,,,,C0155434
Q1451507,symptom,症状,Q169872,Bobble-head doll syndrome,,neurological movement disorder in which patients involuntarily bob their head and shoulders,,C536241,G93.0,348,,C2931137
Q1338684,symptom,症状,Q169872,tension headache,緊張性頭痛,common type of headache classified by The International Classification of Headache Disorders 3rd edition,,D018781,G44.2,339.1,,
Q1277793,symptom,症状,Q169872,myotonia,筋強直症候群,prolonged contraction of muscles,,D009222,G71.1,359.2,3434004,C0027125
Q1036653,symptom,症状,Q169872,highly sensitive person,ハイリー・センシティブ・パーソン,person with sensory processing sensitivity,高度な感覚処理感受性を気質として持つ人,,,,,
Q182180,symptom,症状,Q169872,yawn,あくび,reflex,眠い時に出る呼吸動作,D015000,,,,C0043387
Q595708,symptom,症状,Q169872,Equine exertional rhabdomyolysis,,syndrome,,,,,,
Q2522199,symptom,症状,Q169872,syndrome of Cassandra,カサンドラ(比喩),metaphor originating from Greek mythology,ギリシア神話を起源とするメタファー,,,,,
Q7442204,symptom,症状,Q169872,Seattle windshield pitting epidemic,,mass delusion event in the American state of Washington,,,,,,
Q3508566,symptom,症状,Q169872,immune dysregulation-polyendocrinopathy-enteropathy-X-linked syndrome,IPEX症候群,"hypersensitivity reaction type II disease characterized by onset in infancy of refractory diarrhea, endocrinopathies, type 1 diabetes mellitus, and dermatitis that has material basis in mutation in the FOXP3 gene on chromosome Xp11",,C580192,,,,C0342288
Q7972881,symptom,症状,Q169872,wasting,消耗症,human disease,,D019282,,,,C0043046
Q1638006,symptom,症状,Q169872,Roemheld syndrome,レムヘルト症候群,medical condition,,,,,,C0877059
Q1959715,symptom,症状,Q169872,NAME syndrome,,syndrome,,,D44.8,,,
Q2115682,symptom,症状,Q169872,pseudo-Klinefelter syndrome,,,,,,,,
Q2713697,symptom,症状,Q169872,Fatigue-Syndrom,,,,,,,,
Q3042155,symptom,症状,Q169872,Dyssynchrony,,,,,,,,
Q3508741,symptom,症状,Q169872,hidden hearing loss,隠れ難聴,"typically undetected hearing loss in conventional tests, affecting the ability to hear sounds in noisy environments or with multiple speakers",,D000097942,,,,C0456761
Q2622112,symptom,症状,Q169872,physical dependence,身体的依存,physical condition caused by chronic use of a tolerance-forming drug,離脱による否定的な身体症状を生じさせる状態,,,,,
Q3360152,symptom,症状,Q169872,pachyonychia congenita,,rare group of autosomal dominant skin disorders that are caused by a mutation in one of five different keratin genes,,D053549,Q84.5,757.5,39427000,C0265334
Q2553445,symptom,症状,Q169872,Weaving,,stable vice in horses,,,,,,
Q1641325,symptom,症状,Q169872,low milk supply,母乳不足,production of breast milk by a mother that is of insufficient quantity to meet the nutritional needs of her infant,,,O92.4,676.4,,C0020610
Q2729941,symptom,症状,Q169872,dominant white,優性白色,horse coat color and its genetics,,,,,,
Q3241252,symptom,症状,Q169872,female sexual arousal disorder,冷感症,persistent or recurrent inability to attain sexual arousal or to maintain arousal until the completion of a sexual activity,,,F52.2,302.72,,
Q1797858,symptom,症状,Q169872,LAMB Syndrome,,,,,D44.8,,,
Q2849638,symptom,症状,Q169872,sternal angle,,synarthrotic joint formed by the articulation of the manubrium and the body of the sternum,,,,,,C0222772
Q3026357,symptom,症状,Q169872,diarrhetic shellfish poisoning,下痢性貝中毒,syndrome of shellfish poisoning,,,,,,
Q2697371,symptom,症状,Q169872,Ramsay Hunt syndrome,ラムゼイ・ハント症候群,unrelated neurological syndromes described by James Ramsay Hunt,ウィキメディアの曖昧さ回避ページ,,,,,
Q3054155,symptom,症状,Q169872,spoiled child,甘やかされて育てられる,derogatory term aimed at children who exhibit behavioral problems from being overindulged by their parents or other caregivers,,,,,,
Q2581333,symptom,症状,Q169872,post-concussion syndrome,脳振盪後症候群,organic brain syndrome that occurs following head trauma (i.e. concussion),,D038223,F07.2,310.2,,
Q3398781,symptom,症状,Q169872,amnesic shellfish poisoning,記憶喪失性貝中毒,syndrome of shellfish poisoning,,,,,,
