qid,category_en,category_ja,category_qid,en_label,ja_label,en_description,ja_description,mesh_id,icd10,icd9,snomed_id,umls_id
Q3137609,medical sign,医学的徴候,Q1441305,pseudoaneurysm,,collection of blood and connective tissue outside the wall of a blood vessel or the heart,,D017541,,,,C1510412
Q86008198,medical sign,医学的徴候,Q1441305,The Three Bridge - Kiryat Gat,,,,,,,,
Q1328215,medical sign,医学的徴候,Q1441305,hypocapnia,低炭酸ガス血症,state of reduced carbon dioxide in the blood,,D016857,,,,C0085383
Q2253484,medical sign,医学的徴候,Q1441305,homosexual panic,,panic due to the pressure of perceived sexual cravings from another person of the same sex,,,,,,
Q4375,medical sign,医学的徴候,Q1441305,bronchoconstriction,気管支収縮,constriction of the airways in the lungs,,D016084,,,,C0079043
Q755630,medical sign,医学的徴候,Q1441305,relative energy deficiency in sport,,syndrome caused by chronic low energy availability in athletes,,D053716,,,,
Q114754301,medical sign,医学的徴候,Q1441305,hemorrhagic stroke,,stroke caused by the rupture of a weakened blood vessel in the brain,,D000083302,,,,
Q478613,medical sign,医学的徴候,Q1441305,unhappy triad,,"injury to the anterior cruciate ligament, medial collateral ligament, and meniscus",,,S83.7,,,
Q181923,medical sign,医学的徴候,Q1441305,attention deficit hyperactivity disorder,注意欠陥・多動性障害,neurodevelopmental disorder,神経発達症の一種,D001289,F90.0,,35253001,C4230171
Q396013,medical sign,医学的徴候,Q1441305,agranulocytosis,無顆粒球症,"acute, severe lowered white blood cell count",末梢血中において好中球が極端に減少すること,D000380,,288.0,165508008,C0001824
Q275419,medical sign,医学的徴候,Q1441305,hypotension,低血圧,abnormally low blood pressure,,D007022,I95,458,,C0020649
Q1137870,medical sign,医学的徴候,Q1441305,Courvoisier's law,クールボアジェ徴候,clinical sign pertaining to the gallbladder,無痛性の胆嚢腫大,,,,,C0278021
Q1132653,medical sign,医学的徴候,Q1441305,hypernatremia,高ナトリウム血症,high concentration of sodium ions in the blood,,D006955,E87.0,276.0,,C0020488
Q185089,medical sign,医学的徴候,Q1441305,acidosis,アシドーシス,a process causing increased acidity in the blood and other body tissues,生体の血液の平衡を酸性側にしようとする状態をアシドーシス、塩基性側にしようとする状態をアルカローシスと言う,D000138,E87.2,276.2,,C0001122
Q1142879,medical sign,医学的徴候,Q1441305,gag reflex,咽頭反射,reflex at the back of the throat,,D005683,,,,C0016927
Q81938,medical sign,医学的徴候,Q1441305,pain,疼痛,type of unpleasant feeling,不快な感覚の一種,D010146,R52.9,338,,C0030193
Q120157832,medical sign,医学的徴候,Q1441305,Birthday Trees project,,improve on nutrition and make schools livable places.,,,,,,
Q1146902,medical sign,医学的徴候,Q1441305,underweight,低体重,classification of human body weight,BMI18.5未満の状態。月経不順・不妊・脱毛・骨粗鬆症・精神不安・摂食障害など肉体的又は精神的リスクのみある体重。,D013851,R63.6,,,C0039870
Q1063093,medical sign,医学的徴候,Q1441305,Charcot's cholangitis triad,,for ascending cholangitis,,,,,,
Q56226095,medical sign,医学的徴候,Q1441305,death and legacy of Tom Thomson,,The death and legacy of Canadian artist Tom Thomson,,,,,,
Q1137032,medical sign,医学的徴候,Q1441305,Councilman body,,acidophilic globule of cells that represents a dying hepatocyte,,,,,,C0333745
Q379476,medical sign,医学的徴候,Q1441305,epidermoid cyst,粉瘤腫,human disease,,D004814,L72.0,706.2,,C0014511
Q120898050,medical sign,医学的徴候,Q1441305,death of Anthony Donelson Jr.,,Death of an African American person killed due to interaction with a California Law Enforcement Agency,,,,,,
Q120898195,medical sign,医学的徴候,Q1441305,death of Calvin Whittington,,Death of an African American person killed due to interaction with a California Law Enforcement Agency,,,,,,
Q120898374,medical sign,医学的徴候,Q1441305,death of Darryl Brice Cunningham,,Death of an African American person killed due to interaction with a California Law Enforcement Agency,,,,,,
Q120898934,medical sign,医学的徴候,Q1441305,death of Jonathan Hann,,Death of an African American person killed due to interaction with a California Law Enforcement Agency,,,,,,
Q120899034,medical sign,医学的徴候,Q1441305,death of Kenyon Michael Thomas,,Death of an African American person killed due to interaction with a California Law Enforcement Agency,,,,,,
Q120899327,medical sign,医学的徴候,Q1441305,death of Ocola Vaughn III,,Death of an African American person killed due to interaction with a California Law Enforcement Agency,,,,,,
Q1266051,medical sign,医学的徴候,Q1441305,dark triad,ダークトライアド,"three antisocial personality traits: narcissism, Machiavellianism, and psychopathy",,,,,,
Q794086,medical sign,医学的徴候,Q1441305,hypokalemia,低カリウム血症,Health condition with insufficient potassium in blood,,D007008,E87.6,276.8,,C0020621
Q1298973,medical sign,医学的徴候,Q1441305,small for gestational age,低出生体重児,babies whose birth weight lies below the 10th percentile for that gestational age,,D007236,P05,765,,
Q202758,medical sign,医学的徴候,Q1441305,hypoglycemia,低血糖症,low blood sugar,血糖値が低くなっている状態,D007003,E16.2,,,C0020615
Q18767,medical sign,医学的徴候,Q1441305,primary progressive aphasia,原発性進行性失語,progressive language and speech disorder,,D018888,,,,C0282513
Q625506,medical sign,医学的徴候,Q1441305,preterm birth,早産,birth at a gestational age less than 37 weeks,,D047928,O60.1,765,,C0151526
Q132356290,medical sign,医学的徴候,Q1441305,Starvation of the Obleukhov company,,1856 incident of starvation during the Russian colonization of Amur,,,,,,
Q1093872,medical sign,医学的徴候,Q1441305,Sister Mary Joseph nodule,シスター・ジョセフの小結節,palpable nodule bulging into the umbilicus,,D058288,,,,C0878585
Q3622301,medical sign,医学的徴候,Q1441305,Beck's triad,,triad of signs and symptoms associated with cardiac tamponade,,,,,,
Q1448753,medical sign,医学的徴候,Q1441305,Saint's triad,,medical condition,,,,,,
Q1123968,medical sign,医学的徴候,Q1441305,Möbius sign,,medical condition,,,,,,
Q1102038,medical sign,医学的徴候,Q1441305,clivus edge syndrome,,,,,,,,
Q16859780,medical sign,医学的徴候,Q1441305,Rarefying osteitis,,medical condition,,,,,,
Q7514888,medical sign,医学的徴候,Q1441305,Silhouette sign,,radiologic sign,,,,,,CL459038
Q1445812,medical sign,医学的徴候,Q1441305,Kussmaul's sign,,Kussmaul sign is a paradoxical rise in jugular venous pressure (JVP) on inspiration,,,,,,
Q3150728,medical sign,医学的徴候,Q1441305,ground glass opacity,,"for some diseases or changes in the lungs, examination shows uniform-looking, lighter areas in the lungs",,,,,,C3827002
Q890226,medical sign,医学的徴候,Q1441305,trauma triad of death,外傷死の3徴,"the combination of hypothermia, acidosis and coagulopathy often seen in severe trauma cases",,,,,,
Q7572960,medical sign,医学的徴候,Q1441305,Spalding's sign,,,,,,,,CL459055
Q1282114,medical sign,医学的徴候,Q1441305,speech disorder,発話障害,type of communication disorder in which normal speech is disrupted,,D013064,F98.6,307.0,,C0037822
Q1269330,medical sign,医学的徴候,Q1441305,dysproteinemia,タンパク異常血症,,,,E88.09,,,C0259744
Q1128283,medical sign,医学的徴候,Q1441305,mydriasis,散瞳,increase in size of the pupil's diameter and dilation,疾患や薬物、外傷によって瞳孔が過度に拡大する現象,D015878,H57.0,379.43,,C0026961
Q7833120,medical sign,医学的徴候,Q1441305,Tram track,,radiologic sign,,,,,,
Q2926052,medical sign,医学的徴候,Q1441305,air-bronchogram,,,,,,,,
Q16908589,medical sign,医学的徴候,Q1441305,osteoporosis circumscripta,,decalcified lesion found in Paget's disease,,,,,,
Q1250498,medical sign,医学的徴候,Q1441305,fetal nuchal edema,,ultrasound sign,,,,,,C1850292
Q1036403,medical sign,医学的徴候,Q1441305,hypoproteinemia,低タンパク血症,abnormally low level of protein in the blood,,D007019,E77.8,273.8,,C0020639
Q1149382,medical sign,医学的徴候,Q1441305,Janeway lesion,,medical condition,,,A41.8,,,C1532713
Q1036696,medical sign,医学的徴候,Q1441305,hypothermia,低体温症,condition caused when the human body gets too cold,体温が35℃未満に下がった状態,D007035,T68,991.6,,C0020672
Q1188913,medical sign,医学的徴候,Q1441305,Dennie–Morgan fold,,fold or line in the skin below the lower eyelid,,,,,,C1328339
Q1270758,medical sign,医学的徴候,Q1441305,deviation conjugée,,"medical sign indicating brain damage (e.g. a stroke in the middle cerebral artery), wherein the pupils of the eye tend to move toward the side of the body where the lesion is located;the symptom was described by Swiss neurologist Jean-Louis Prévost",,,,,,
Q16919133,medical sign,医学的徴候,Q1441305,osteopathia striata,,radiologic sign,,,,,,C0265513
Q7623995,medical sign,医学的徴候,Q1441305,String sign,,medical term used in diagnosing hypertrophy pyloric stenosis,,,,,,CL459082
Q1122344,medical sign,医学的徴候,Q1441305,Kussmaul breathing,クスマウル呼吸,hyperventilation associated with metabolic acidosis,,,,,,C0541813
Q3771629,medical sign,医学的徴候,Q1441305,hypomagnesemia,マグネシウム欠乏症,condition of low level of magnesium in the body,,,E83.4,275.2,,
Q7987424,medical sign,医学的徴候,Q1441305,Westermark sign,,radiologic sign,,,,,,
Q926415,medical sign,医学的徴候,Q1441305,Cushing's triad,,,,,,,,
Q7062535,medical sign,医学的徴候,Q1441305,Notching of the ribs,,radiologic sign,,,,,,
Q7090075,medical sign,医学的徴候,Q1441305,Omental cake,,radiologic sign,,,,,,
Q7400156,medical sign,医学的徴候,Q1441305,Sail sign of the chest,,radiologic sign,,,,,,CL459005
Q1063091,medical sign,医学的徴候,Q1441305,Charcot's neurologic triad,,triad of clinical signs associated with multiple sclerosis,,,,,,
Q1090174,medical sign,医学的徴候,Q1441305,Chvostek sign,クボステーク徴候,clinical sign of existing nerve hyperexcitability,,,,,,C0234180
Q1459899,medical sign,医学的徴候,Q1441305,Prehn's sign,プレーン徴候,medical sign for testicular pain,,,,,,
Q1166878,medical sign,医学的徴候,Q1441305,Grey Turner's sign,,physical sign observed in acute pancreatitis,,,,,,C0232799
Q1207349,medical sign,医学的徴候,Q1441305,decerebration,,elimination of cerebral brain function,,D003655,,,,C0231521
Q194290,medical sign,医学的徴候,Q1441305,dehydration,脱水,deficit of total body water,体内の水分不足,D003681,E86,276.5,,C0011175
Q1270992,medical sign,医学的徴候,Q1441305,Döhle bodies,デーレ小体,basophilic leukocyte inclusions located in the peripheral cytoplasm of neutrophils,好中球の細胞質にみられる淡青色の封入体,,,,,
Q3304850,medical sign,医学的徴候,Q1441305,Golden S sign,,radiologic sign,,,,,,
Q4158814,medical sign,医学的徴候,Q1441305,Tree-in-bud sign,,radiologic sign,,,,,,
Q16929803,medical sign,医学的徴候,Q1441305,Wimberger's sign,,clinical sign for congenital syphilis,,,,,,
Q2363109,medical sign,医学的徴候,Q1441305,boiling frog,茹でガエル,metaphor for the inability of people to react to significant changes that occur gradually,,,,,,
Q1424702,medical sign,医学的徴候,Q1441305,Hutchinson's teeth,ハッチンソンの歯,clinical sign of congenital syphilis,先天性梅毒の臨床徴候,,,,,C0020186
Q1424895,medical sign,医学的徴候,Q1441305,clonus,クローヌス,medical sign,,,,,,
Q7798834,medical sign,医学的徴候,Q1441305,Thumbprint sign,,radiologic sign,,,,,,CL459126
Q7334672,medical sign,医学的徴候,Q1441305,Ring-enhancing lesion,,radiologic sign,,,,,,
Q12099023,medical sign,医学的徴候,Q1441305,"attention deficit hyperactivity disorder, predominantly hyperactive-impulsive",,,,,F90.1,314.01,,
Q20707026,medical sign,医学的徴候,Q1441305,Klemm's sign,,radiologic sign,,,,,,
Q1214063,medical sign,医学的徴候,Q1441305,blood in stool,下血,symptom,,,,578.1,,
Q1469832,medical sign,医学的徴候,Q1441305,Froment's sign,フローマン徴候,neurological sign of ulnar nerve damage,,,,,,C1290999
Q133244,medical sign,医学的徴候,Q1441305,jaundice,黄疸,human disease,,D007565,R17,782.4,18165001,C0022346
Q1429154,medical sign,医学的徴候,Q1441305,hyperreflexia,反射亢進,symptom,,,,,,
Q4419857,medical sign,医学的徴候,Q1441305,Halo sign,,radiologic sign,,,,,,
Q7127685,medical sign,医学的徴候,Q1441305,Palla's sign,,clinical sign of a pulmonary embolism on chest x-ray,,,,,,
Q3321079,medical sign,医学的徴候,Q1441305,Charcot's triad,,triad of clinical signs,,,,,,
Q7168376,medical sign,医学的徴候,Q1441305,peribronchial cuffing,,radiologic sign which occurs when excess fluid or mucus buildup in the small airway passages of the lung causes localized patches of atelectasis,,,,,,
Q961326,medical sign,医学的徴候,Q1441305,oliguria,乏尿,low output of urine,,D009846,R34,788.5,,C0028961
Q127724,medical sign,医学的徴候,Q1441305,cataract,白内障,"clouding of the lens inside the eye, which leads to low vision",,D002386,,,128306009,C0086543
Q7562159,medical sign,医学的徴候,Q1441305,Sonographic Murphy sign,,radiologic sign,,,,,,
Q1103561,medical sign,医学的徴候,Q1441305,Clutton's joints,,term describing the finding of symmetrical joint swelling seen in patients with congenital syphilis,,,M03.1,,,
Q7254794,medical sign,医学的徴候,Q1441305,Pseudofracture,,,,,,,,C0240820
Q1479485,medical sign,医学的徴候,Q1441305,hypoxemia,低酸素血症,abnormally low level of oxygen in the blood,,,,799.02,,C0700292
Q131191,medical sign,医学的徴候,Q1441305,body mass index,ボディマス指数,measure of relative weight based on an individual's mass and height,ヒトの肥満度を表す体格指数,D015992,,,,C1305855
Q123562711,medical sign,医学的徴候,Q1441305,increased systemic arterial blood pressure,,punctual raise in blood pressure,,,,,,
Q131418280,medical sign,医学的徴候,Q1441305,Anteater nose sign,,Pattern seen in radiologic examinations,,,,,,
Q131418293,medical sign,医学的徴候,Q1441305,Absent bowtie sign,,Pattern seen in radiologic examinations,,,,,,
Q131418338,medical sign,医学的徴候,Q1441305,Aortic nipple sign,,Pattern seen in radiologic examinations,,,,,,
Q120833521,medical sign,医学的徴候,Q1441305,Strauss Syndrom,,Neurodevelopmental disorder,,,,,,
Q123221108,medical sign,医学的徴候,Q1441305,skin lesion,,,,,,,,
Q120298401,medical sign,医学的徴候,Q1441305,Babinski sign,,reflex found in normal infants consisting of dorsiflexion of the hallux and abduction of the other toes in response to cutaneous stimulation of the plantar surface of the foot,,D001405,,,,
Q48972081,medical sign,医学的徴候,Q1441305,Wilkinson's syndrome,,medical condition,,,,,,
Q45462238,medical sign,医学的徴候,Q1441305,alcohol amnestic disorder,,"alcoholic psychosis with a combination of polyneuritis with memory span, including striking loss of recent memory, disordered time appreciation and confabulations",,D000425,,291.11,,
Q2204646,medical sign,医学的徴候,Q1441305,Bekhterev–Mendel reflex,,clinical sign found in patients with pyramidal tract lesions,,,,,,
Q2888709,medical sign,医学的徴候,Q1441305,claudication,,"impairment in walking, or pain, discomfort or tiredness in the legs that occurs during walking and is relieved by rest",,,I73.9,443.9,,
Q1021723,medical sign,医学的徴候,Q1441305,hair-on-end sign,,,,,,,,CL458770
Q2868706,medical sign,医学的徴候,Q1441305,asynergy,,clinical sign,,,,,,
Q1923089,medical sign,医学的徴候,Q1441305,Rossolimo's sign,ロッソリモ反射,medical condition,,,,,,
Q2357737,medical sign,医学的徴候,Q1441305,Strümpell's sign,,medical condition,,,,,,
Q2001556,medical sign,医学的徴候,Q1441305,Risus sardonicus,痙笑,spasm of the facial muscles,,,,,,C0343494
Q2248747,medical sign,医学的徴候,Q1441305,relieving posture,,,,,,,,C0231482
Q2340398,medical sign,医学的徴候,Q1441305,Hoffmann's sign,ホフマン反射,reflex test,,,,,,
Q2841504,medical sign,医学的徴候,Q1441305,Alacrima,,abnormality in tear production,,C562827,,,253215004,C0344505
Q2550477,medical sign,医学的徴候,Q1441305,pulsus paradoxus,奇脈,is an abnormally large decrease in systolic blood pressure and pulse wave amplitude during inspiration.,,,,,,C0232118
Q30150660,medical sign,医学的徴候,Q1441305,Dense metaphyseal bands,,Human phenotype,,,,,,C4020919
Q2722991,medical sign,医学的徴候,Q1441305,bubo,,inflammation of the lymph nodes,,,,,,
Q2859076,medical sign,医学的徴候,Q1441305,apyrexy,,"(in pathology) normal interval or period of intermission in a fever. Also, the absence of a fever",,,,,,
Q338802,medical sign,医学的徴候,Q1441305,clinically isolated syndrome,,initial neurological episode related to nerve tissue,,,,,,
Q1822605,medical sign,医学的徴候,Q1441305,porphyrinuria,,presence of porphyrins in the urine,,,,,,
Q6813809,medical sign,医学的徴候,Q1441305,Meltzer's triad,,medical condition,,,,,,
Q1938321,medical sign,医学的徴候,Q1441305,decorticate rigidity,,,,,,,,
Q1953811,medical sign,医学的徴候,Q1441305,Murphy's sign,マーフィー徴候,maneuver during a physical examination as part of the abdominal examination,,,,,,C0277977
Q2849606,medical sign,医学的徴候,Q1441305,vasospasm,血管痙攣,condition in which an arterial spasm leads to vasoconstriction,,,,443.9,,
Q2297551,medical sign,医学的徴候,Q1441305,soft marker,,,,,,,,
Q5420062,medical sign,医学的徴候,Q1441305,exercise intolerance,,medical condition,,,,,,C0424551
Q2824385,medical sign,医学的徴候,Q1441305,adiastole,,,,,,,,
Q2342365,medical sign,医学的徴候,Q1441305,Stellwag's sign,,medical sign in the eyes,,,,,,
Q2336398,medical sign,医学的徴候,Q1441305,pallor,,pale skin,,D010167,R23.1,782.61,,C0030232
Q2902456,medical sign,医学的徴候,Q1441305,pulsus bigeminus,二段脈,,,,,,,C0235477
Q28458413,medical sign,医学的徴候,Q1441305,Hot nose sign,,radiologic sign,,,,,,CL458799
Q2868964,medical sign,医学的徴候,Q1441305,athalamia,,flat anterior chamber of eye,,,,,,C2881110
Q2359404,medical sign,医学的徴候,Q1441305,falls in older adults,,"involuntary loss of postural stability, resulting in impacts against the ground or other objects, related to aging, audiological changes, and balance disorders",,,,,,
Q4867827,medical sign,医学的徴候,Q1441305,Basopenia,好塩基球減少,medical condition,,,D72.8,288.59,,C0477318
Q913667,medical sign,医学的徴候,Q1441305,pulmonary consolidation,,radiologic sign,,,,,,C0521530
Q24963566,medical sign,医学的徴候,Q1441305,Klein's line,,medical condition,,,,,,
Q143115,medical sign,医学的徴候,Q1441305,Chaddock reflex,チャドック反射,diagnostic reflex similar to the Babinski reflex,,,,,,C1531651
Q757681,medical sign,医学的徴候,Q1441305,canine atopic dermatitis,,,,,,,,
Q30314400,medical sign,医学的徴候,Q1441305,White cerebellum sign,,radiologic sign,,,,,,
Q24962830,medical sign,医学的徴候,Q1441305,Bohler's angle,,,,,,,,
Q5870068,medical sign,医学的徴候,Q1441305,1945 Laroya fires,,1945 spontaneous combustions,,,,,,
Q7993737,medical sign,医学的徴候,Q1441305,Whipple's triad,,medical condition,,,,,,
Q1956682,medical sign,医学的徴候,Q1441305,myoglobinuria,,myopathy that is characterized by an increased urinary excretion of myoglobin,,D009212,R82.1,791.3,48165008,C0027080
Q22009275,medical sign,医学的徴候,Q1441305,hypoferritinemia,,,,,,,,CL1379231
Q1267017,medical sign,医学的徴候,Q1441305,brief reactive psychosis,,psychosis,,,F239,298.8,,C0033958
Q12248844,medical sign,医学的徴候,Q1441305,hypocalciuria,,lack of calcium in the urine,,,,,,C0020599
Q1566762,medical sign,医学的徴候,Q1441305,steeple sign,,radiologic sign,,,,,,
Q2510343,medical sign,医学的徴候,Q1441305,Asboe-Hansen sign,アスボー・ハンセン徴候,extension of a blister to adjacent unblistered skin when pressure is put on the top of the bulla,,,,,,
Q2099990,medical sign,医学的徴候,Q1441305,pneumatosis intestinalis,,"pneumatosis of an intestine, that is, gas cysts in the bowel wall",,,R93.3,569.89,,C1112565
Q1392898,medical sign,医学的徴候,Q1441305,cardio-thoracic ratio,心胸郭比,,,,,,,C2363738
Q2850131,medical sign,医学的徴候,Q1441305,anisokaryosis,,presence of cell nuclei of different sizes,,,,,,C0333905
Q2513166,medical sign,医学的徴候,Q1441305,venous hypertension,,,,,I87.3,,,
Q24963567,medical sign,医学的徴候,Q1441305,Trethowan's sign,,Diagnostic aid in radiographs of the pelvis,,,,,,
Q407922,medical sign,医学的徴候,Q1441305,air trapping,,abnormal retention of air in the lungs where it is difficult to exhale completely,,,,,,C0231819
Q255605,medical sign,医学的徴候,Q1441305,Blumberg's sign,ブルンベルグ徴候,clinical sign indicative of peritonitis,,,,,,
Q22907918,medical sign,医学的徴候,Q1441305,double bubble,,radiologic sign,,,,,,
Q22908325,medical sign,医学的徴候,Q1441305,Rigler's triad,,radiologic sign,,,,,,
Q22908899,medical sign,医学的徴候,Q1441305,Hilum overlay sign,,radiologic sign,,,,,,
Q22908967,medical sign,医学的徴候,Q1441305,Hot quadrate sign,,radiologic sign,,,,,,
Q2228992,medical sign,医学的徴候,Q1441305,winged scapula,翼状肩甲,skeletal muscle condition around the shoulder blade,,,,736.89,,C0240953
Q245639,medical sign,医学的徴候,Q1441305,urinary cast,尿円柱,Abnormal protein precipitations in urine in certain disease states,,,,,,
Q2559613,medical sign,医学的徴候,Q1441305,inappropriate social behavior,,,,,,,,C2220010
Q1812920,medical sign,医学的徴候,Q1441305,adult attention deficit hyperactivity disorder,大人のADHD,the neurobiological condition of attention deficit hyperactivity disorder (ADHD) in adults,多動性のみ幼少期よりも改善した状態のADHD,,,,,
Q1409281,medical sign,医学的徴候,Q1441305,Fat pad sign,,radiologic sign,,,,,,CL458721
Q2584991,medical sign,医学的徴候,Q1441305,Winterbottom's sign,,"swelling of lymph nodes (lymphadenopathy) along the back of the neck, in the posterior cervical chain of lymph nodes",,,,,,
Q2586069,medical sign,医学的徴候,Q1441305,Wischnewski spots,,Sign of death by hypothermia - erosions in gastric mucosa,,,,,,
Q16831900,medical sign,医学的徴候,Q1441305,intracranial hypotension,頭蓋内低血圧,human disease,,D019585,,,,C0524812
Q1914737,medical sign,医学的徴候,Q1441305,battered child syndrome,,the collection of injuries sustained by a child as a result of repeated mistreatment or beating,,D001497,T74.1,,,C0004842
Q246147,medical sign,医学的徴候,Q1441305,cytopenia,血球減少,medical condition,,D000095542,,,,C0010828
Q20707404,medical sign,医学的徴候,Q1441305,Cupola sign,,radiologic sign,,,,,,
Q418527,medical sign,医学的徴候,Q1441305,akinesia,無動症,inability to initiate movement,,,,,,
Q378580,medical sign,医学的徴候,Q1441305,Adson's sign,,loss of the radial pulse in the arm by rotating head to the ipsilateral side with extended neck following deep inspiration,,,,,,
Q2568913,medical sign,医学的徴候,Q1441305,blue baby syndrome,青色児症候群,two situations that lead to cyanosis in infants,,,,,,C1367053
Q371226,medical sign,医学的徴候,Q1441305,pimple,,localised skin elevation,,,,,,
Q152234,medical sign,医学的徴候,Q1441305,edema,浮腫,abnormal accumulation of fluid in the interstitium,,D004487,R60.9,782.3,,C0013604
Q5554678,medical sign,医学的徴候,Q1441305,Getting the wind knocked out of you,,Idiom,,,,,,
Q244913,medical sign,医学的徴候,Q1441305,vaginal bleeding,不正出血,bleeding through the vagina,,,N93.8,,,C0151706
Q1981783,medical sign,医学的徴候,Q1441305,pathognomonic,特徴的症状,characteristic for a particular disease,,,,,,
Q2742923,medical sign,医学的徴候,Q1441305,de Musset's sign,,condition in which there is rhythmic bobbing of the head in synchrony with the beating of the heart,,,,,,
Q339054,medical sign,医学的徴候,Q1441305,Seidel test,,medical diagnostic method,,,,,,
Q380203,medical sign,医学的徴候,Q1441305,adynamia,,Pathological lack of strength,,,,,,
Q1398980,medical sign,医学的徴候,Q1441305,Kerley lines,,radiologic sign,,,,,,
Q2536390,medical sign,医学的徴候,Q1441305,abdominal distention,腹部膨満,physical symptom,,,,,,C0000731
Q10295810,medical sign,医学的徴候,Q1441305,hypocholesterolemia,,decreased concentration of cholesterol in the blood,,,,,,C0151718
Q10295815,medical sign,医学的徴候,Q1441305,Hypofibrinogenemia,,Decreased concentration of fibrinogen in the blood.,,,,,,C0553681
Q1586180,medical sign,医学的徴候,Q1441305,Harris lines,発育阻止線,medical condition,,,,,,
Q21045226,medical sign,医学的徴候,Q1441305,Cheerio sign,,pulmonary nodules with a central lucent cavity,,,,,,
Q119715389,medical sign,医学的徴候,Q1441305,Acorn cyst sign,,radiologic sign,,,,,,
Q115743908,medical sign,医学的徴候,Q1441305,radicular arm pain,,medical sign or symptom,,,,,,
Q115801702,medical sign,医学的徴候,Q1441305,Whirlpool sign,,radiologic sign where bowel rotates around mesentery,,,,,,
Q116776708,medical sign,医学的徴候,Q1441305,skin turgor,,elasticity of skin,,,,,,
Q115743250,medical sign,医学的徴候,Q1441305,downward displacement of the brain,,clinical sign,,,,,,
Q115743869,medical sign,医学的徴候,Q1441305,cranial nerve dysfunction,,clinical sign,,,,,,
Q1638131,medical sign,医学的徴候,Q1441305,hyperesthesia,知覚過敏,exaggerated sensations of tactile stimuli,,D006941,R20.3,782.0,,C0020453
